name,school,subschool,descriptor,spell_level,casting_time,components,costly_components,range,area,effect,targets,duration,dismissible,shapeable,saving_throw,spell_resistence,description,source,verbal,somatic,material,focus,divine_focus,sor,wiz,cleric,druid,ranger,bard,paladin,alchemist,summoner,witch,inquisitor,oracle,antipaladin,magus,adept,deity,SLA_Level,domain,short_description,acid,air,chaotic,cold,curse,darkness,death,disease,earth,electricity,emotion,evil,fear,fire,force,good,language_dependent,lawful,light,mind_affecting,pain,poison,shadow,sonic,water,linktext,id,material_costs,bloodline,patron,mythic_text,augmented,mythic,bloodrager,shaman,psychic,medium,mesmerist,occultist,spiritualist,skald,investigator,hunter,haunt_statistics,ruse,draconic,meditative,summoner_unchained
Detect The Faithful,divination,,,"antipaladin 1, cleric/oracle 1, druid 1, inquisitor 1, paladin 1, ranger 1, shaman 1",1 standard action,"V, S, DF",0,60 ft.,cone-shaped emanation,,,"concentration, up to 1 minute/level (D)",1,0,none,no,"You can detect other worshipers of your deity (mortal worshipers, outsider servants, and so on). The amount of information revealed depends on how long you focus on a particular area or subject. 1st Round: Presence or absence of the faithful. 2nd Round: Number of individual faithful in the area. 3rd Round: The exact location of each worshiper. If a fellow worshiper is outside your line of sight, then you discern his direction but not his exact location. Each round, you can rotate to detect worshipers in a new area. The spell can penetrate barriers, but a sheet of lead, 1 foot of stone, 1 inch of common metal, or 3 feet of wood or dirt blocks it. A creature's personal interpretation of its beliefs determines whether or not it is of the same faith as you-hence heretics and splinter cultists of your deity still count as worshipers of that deity. Furthermore, since the spell picks up a creature's current beliefs and feelings, a creature actively pretending to be a member of the same faith also appears to the spell to be a member. Thus, the spell is still useful in locating potential hidden members of the same faith among the general populace, but on its own, it doesn't weed out spies.",Ultimate Intrigue,1,1,0,0,1,,,1,1,1,,1,,,,1,1,1,,,,1,,Find others of the same faith.,0,0,0,0,0,0,0,0,0,0,0,0,0,0,0,0,0,0,0,0,0,0,0,0,0,,2464,,,,,,0,,1,,,,,,,,1,,0,0,0,
Know Peerage,divination,,mind-affecting,"bard 1, cleric/oracle 2, inquisitor 2, medium 1, mesmerist 2, occultist 2, paladin 1, psychic 2, sorcerer/wizard 2",1 standard action,"V, S, M (thread from a tabard or livery)",0,touch,,,creature touched,10 minutes/level,0,0,Will negates (harmless),yes (harmless),"You impart your knowledge of nobility and peerage to the target, allowing her to recognize members of noble households, differentiate one set of heraldry from another, and otherwise identify who's who at a royal gala or other noteworthy social event. The target is able to identify noble individuals, noble family names, and noble crests, signets, heraldry, and other symbols. The target treats her number of ranks in Knowledge (nobility) as though it were equal to your number of ranks in Knowledge (nobility), to a maximum of 5 ranks and a minimum of 0. If the target's number of ranks is greater than yours, she uses her own number of ranks instead. In addition, if the target's new total skill bonus on Knowledge (nobility) checks is at least +0, she automatically succeeds on all Knowledge (nobility) checks with a DC of 10 or lower.",Ultimate Intrigue,1,1,1,0,0,2,2,2,,,1,1,,,,2,2,,,,,2,,Target uses your Knowledge (nobility) ranks.,0,0,0,0,0,0,0,0,0,0,0,0,0,0,0,0,0,0,0,1,0,0,0,0,0,,2488,,,,,,0,,,2,1,2,2,,,,,,0,0,0,
Red Hand Of The Killer,necromancy,,,"bard 4, cleric/oracle 4, inquisitor 4, medium 3, occultist 4, paladin 4, psychic 5, sorcerer/wizard 5, spiritualist 4, witch 5",1 standard action,"V, S, M (a black candle), F (a corpse slain no more than 1 day ago per caster level)",0,see text,,,one creature,1 day/level (D),1,0,Will negates,yes,"Drawing upon the spiritual link between a corpse and its killer, you reach out across space to brand the killer of the corpse you used as a focus for this spell, creating a physical manifestation of the killer's guilt. The killer's right hand becomes stained indelibly red, and this stain can't be removed (although it can be hidden by magical or mundane means, such as disguise self or by wearing gloves). If the killer is not humanoid, or doesn't have a right hand for some other reason, the spell instead causes a red stain in the shape of a hand to appear elsewhere on the creature's body (typically on the chest). This spell affects only the creature that directly killed the targeted corpse. Other individuals that contributed to the target's death are unaffected, and if the victim did not die from violence or died indirectly (for instance, if the creature died from suffocating after someone trapped it in a room filling with water), then the spell has no effect. The killer can attempt a Will save to resist the spell's effects. Distance is not a factor, but the killer must be on the same plane as you at the time you cast the spell, or the spell fails. Once a corpse has acted as the focus for red hand of the killer, it can never act as the focus for another casting of red hand of the killer.",Ultimate Intrigue,1,1,1,0,0,5,5,4,,,4,4,,,5,4,4,,,,,5,,Stain the hand of a creature’s killer red.,0,0,0,0,0,0,0,0,0,0,0,0,0,0,0,0,0,0,0,0,0,0,0,0,0,,2509,,,,,,0,,,5,3,,4,4,,,,,0,0,0,
They Know,enchantment,compulsion,"emotionUM, fear","bard 3, inquisitor 3, mesmerist 3, paladin 3, psychic 4, shaman 4, witch 4",1 standard action,"V, S, F/DF, M (a drop of black ink)",0,medium (100 ft. plus 10 ft./level),,,one intelligent creature,1 minute/level (D),1,0,Will negates,yes,"You instill a target with the fear that the nearest other intelligent creature knows her darkest secret. If she is in the midst of another situation as vital as protecting her darkest secret, such as combat, this doesn't cause her to cease participating, but otherwise, she becomes compelled to use her abilities and skills to determine exactly how much the other individual knows. Even if she isn't around other creatures or otherwise avoids confronting her paranoia for a time, the nagging fear causes the target to become shaken for the duration of the spell (though this doesn't stack with other fear effects to make the target frightened or panicked). The subject's paranoia increases over time, forcing her to take additional steps to protect herself from the other creature. Depending on her personality (or subject to the GM's discretion), she might confess, publicly demand to know what the other creature knows, attack the other creature to silence it, or offer the other creature a bribe. The spell fails if the target truly feels she has nothing to hide.",Ultimate Intrigue,1,1,1,0,1,,,,,,3,3,,,4,3,,,,,,3,,Convince target that a nearby creature knows her greatest secret.,0,0,0,0,0,0,0,0,0,0,1,0,1,0,0,0,0,0,0,0,0,0,0,0,0,,2518,,,,,,0,,4,4,,3,,,,,,,0,0,0,
Guardian Armor,conjuration,teleportation,,"antipaladin 1, bloodrager 1, cleric/oracle 1, inquisitor 1, magus 1, occultist 1, paladin 1, sorcerer/wizard 1",1 immediate action,"V, S, F (armor worn)",0,close (25 ft. + 5 ft./2 levels),,,one willing creature; see below,instantaneous,0,0,none,yes,"This spell teleports the suit of armor you are wearing off of your body and onto an ally within range; the target must be the same size and general shape as you. This armor appears on the target's body fully formed and properly donned, granting the creature the immediate benefit of its protection. If the target of guardian armor was already wearing armor, the armor wearing it is removed from the target's body and falls undamaged into an adjacent square.",Armor Masters Handbook,1,1,0,0,0,1,1,1,,,,1,,,,1,1,1,1,,,1,,,0,0,0,0,0,0,0,0,0,0,0,0,0,0,0,0,0,0,0,0,0,0,0,0,0,,2531,,,,,,0,1,,,,,1,,,,,,0,0,0,
Revenant Armor,transmutation,,,"antipaladin 3, cleric/oracle 4, magus 4, medium 4, occultist 4, paladin 3, shaman 3, sorcerer/wizard 4, spiritualist 3, witch 3",1 standard action,"V, S, F (one suit of armor)",0,close (25 ft. + 5 ft./2 levels),,,one suit of armor,1 day/level or 1 hour/level; see below,0,0,none,no,"This spell endows a suit of armor with a singular purpose realized only after its wearer goes unconscious or is killed; whenever the wearer of a suit of armor warded by revenant armor is brought below 0 hit points or otherwise rendered unconscious (but not paralyzed or held) in combat, the armor is immediately brought to life as a Medium animated object. This animated suit of armor still contains the unconscious (or dead) body of its former wearer and moves with a shambling gait at a speed of 20 feet. This animated object has average hit points and, if the armor is made from metal, it has the metal animated object extraordinary ability (plus additional abilities based on the type of metal, as indicated on page 14 of the Pathfinder RPG Bestiary). Once animated, the revenant armor remains standing (and stands if knocked prone, doing so without provoking attacks of opportunity), and prevents the wearer of the armor from being considered helpless. If an ally of the wearer is within range of the armor, she can direct it to move, though it refuses to go anywhere that requires a skill check. If grappled or otherwise restrained, it can attempt to break free with a Strength score equal to your caster level and a CMB equal to 1 + your caster level + the armor's Strength modifier. If the armor's wearer is reduced to dust, made conscious, or removed from the armor, the spell ends.",Armor Masters Handbook,1,1,0,0,0,4,4,4,,,,3,,,3,,4,3,4,,,4,,,0,0,0,0,0,0,0,0,0,0,0,0,0,0,0,0,0,0,0,0,0,0,0,0,0,,2532,,,,,,0,,3,,4,,4,3,,,,,0,0,0,
Shield Of Shards,transmutation,,,"bloodrager 1, cleric/oracle 2, inquisitor 2, magus 2, medium 2, paladin 1, shaman 2",1 standard action,"V, S, F (a shield)",0,personal,,,one shield you wield,1 round/level,0,0,none,no,"This defensive spell must be cast on a shield you are currently wielding, and fractures the shield into two shards, plus one additional shard per 2 caster levels (to a maximum of 12 shards at 20th level). While shield of shards is active, you lose your shield's bonus to AC as its broken pieces orbit you. On your turn, you can direct the shards to attack an adjacent opponent as a move action. The shards' attack bonus is equal to your caster level + the modifier for the ability score that determines your spell save DCs. The shards deal an amount of slashing and piercing damage equal to 1d4 points + 1 point per shard beyond the first, and have a threat range of 19-20. They are considered magic weapons for the purpose of bypassing damage reduction. Additionally, if your shield is made from a special material (such as adamantine), the shards penetrate damage reduction and hardness as if they were weapons made from the same material. At the end of this spell's duration, the shards reform into their original shield form. You regain its shield bonus to AC, provided you still have a free hand in which to wield it. Otherwise, the shield falls at your feet in your square.",Armor Masters Handbook,1,1,0,0,0,,,2,,,,1,,,,2,2,,2,,,2,,,0,0,0,0,0,0,0,0,0,0,0,0,0,0,0,0,0,0,0,0,0,0,0,0,0,,2533,,,,,,0,1,2,,2,,,,,,,,0,0,0,
Spiritual Squire,evocation,,force,"antipaladin 2, cleric/oracle 2, inquisitor 2, paladin 2, shaman 2, spiritualist 2",1 standard action,"V, S, DF",0,medium (100 ft. + 10 ft./level),,,,1 minute/level (D),1,0,none,no,"This spell causes an ally made of pure force to appear in a single 5-foot square within range. The ally takes the form of a servant of your god (if any) or an ancestor. The spiritual squire occupies its space, though you and your allies can move through it, since it is your ally. While the spiritual squire appears to wear armor and carry a weapon, it cannot make attacks and does not threaten any spaces. On your turn, the spiritual squire can do one of the following: retrieve one stowed item from your possessions, carry an object weighing no more than 10 pounds per caster level, hand you an object it is carrying, perform the aid another action on your behalf or for one of your allies, or help one creature of your choice don armor (which then takes half the normal time). When the spiritual squire attempts the aid another action in combat, its attack bonus is equal to your base attack bonus + your Wisdom modifier. Each round after the first as a swift action, you can order the spiritual squire to move. It has a speed of 30 feet. Being a construct of force, the spiritual squire cannot be harmed by any physical attacks, but disintegrate, dispel magic, a rod of cancellation, or a sphere of annihilation affects it. A spiritual ally's AC against touch attacks is 10.",Armor Masters Handbook,1,1,0,0,1,,,2,,,,2,,,,2,2,2,,,,2,,,0,0,0,0,0,0,0,0,0,0,0,0,0,0,1,0,0,0,0,0,0,0,0,0,0,,2534,,,,,,0,,2,,,,,2,,,,,0,0,0,
Flash Forward,conjuration,teleportation,,"alchemist 4, antipaladin 4, bard 4, bloodrager 4, inquisitor 4, magus 4, medium 4, occultist 4, paladin 4, psychic 5, sorcerer/wizard 5",1 standard action,"V, S, F (a single gear or bit of clockwork)",0,personal,,,you,instantaneous,0,0,none (harmless),no,"You cheat the laws of time and enter into combat before reverting back to your original position. As part of the action to cast the spell, you make a charge attack against an enemy. You make this charge attack normally, accounting for terrain, obstacles, attacks of opportunity, attack rolls, and damage rolls. At the end of your charge action, you instantly teleport back to your original location as a free action. Any damage or conditions dealt by you or to you during this action are real and remain when you return to your original location.",Magic Tactics Toolbox,1,1,0,0,0,5,5,,,,4,4,4,,,4,,4,4,,,5,,,0,0,0,0,0,0,0,0,0,0,0,0,0,0,0,0,0,0,0,0,0,0,0,0,0,,2536,,,,,,0,4,,5,4,,4,,,,,,0,0,0,
Oath Of Anonymity,illusion,glamer,,"bard 0, inquisitor 0, medium 0, paladin 1, sorcerer/wizard 0",1 standard action,V,0,personal,,,you,10 minutes/level,0,0,,,"You swear an oath not to reveal your identity, magically preventing anyone from discovering it so long as you avoid revealing your face or other easily identifiable features. The spell distorts your voice and subtly alters your body language and the appearance of your gear and any animals you use, whether as companions, mounts, or otherwise. This spell does not make you appear to be a different creature type, nor does it change your apparent height or body type. This spell provides you with a +10 bonus on Disguise checks to conceal your identity, but not on checks to impersonate anyone in particular. This spell distorts the appearance of your voice, gear, and animals in the same way each time, essentially creating an alternate persona that can be recognized by those who have observed it before.",Inner Sea Intrigue,1,0,0,0,0,0,0,,,,0,1,,,,0,,,,,,0,,,0,0,0,0,0,0,0,0,0,0,0,0,0,0,0,0,0,0,0,0,0,0,0,0,0,,2577,,,,,,0,,,,0,,,,,,,,0,0,0,
Trial By Fire,evocation,,fire,"antipaladin 3, cleric/oracle 3, inquisitor 3, paladin 3",1 standard action,"V, S, DF",0,touch,,,creature touched,instantaneous,0,0,None,yes,"You test a creature's purity of convictions by exposing it to a sheet of divine fire. Unless the target's alignment is within one step of your deity's, the spell deals 1d6 points of damage per 2 caster levels (maximum 5d6 points of damage). Half the damage is fire damage, but the other half results directly from divine power and is therefore not subject to being reduced by resistance to fire-based attacks. Additionally, if the target has an element of its alignment that is in direct opposition to your (chaos opposes law and evil opposes good), you can also attempt an Intimidate check to demoralize the target as a free action.",Spymaster's Handbook,1,1,0,0,1,,,3,,,,3,,,,3,3,3,,,,3,,,0,0,0,0,0,0,0,0,0,0,0,0,0,1,0,0,0,0,0,0,0,0,0,0,0,,2597,,,,,,0,,,,,,,,,,,,0,0,0,
Draconic Ally,conjuration,creation,draconic,"antipaladin 3, bloodrager 3, paladin 3, psychic 3, occultist 3, sorcerer/wizard 3, spiritualist 3, summoner/unchained summoner 3",10 minutes,"V, S, M (a scale from a dragon and 250 gp)",1,close (25 ft. + 5 ft./2 levels),,one intelligent draconic servant,,1 day/level (D),1,0,none,no,"You create a semi-living intelligent draconic servant that loyally obeys and serves you. Treat this servant as a pseudodragon with all of the abilities granted by one of the following spells: form of the alien dragon I, form of the dragon I, or form of the exotic dragon I. Your draconic ally can use its breath weapon once per day. Once conjured, the creature is not limited to the spell's range, and can go a considerable distance to carry out missions at your command. The draconic ally speaks one language of your choice that you know. You cannot have more than one draconic ally at a time. As long as a previous ally exists, you cannot successfully cast this spell again. If you have a breath weapon, you can cast this spell as a standard action by expending one use of your breath weapon as a free action when you cast the spell. Clerics, inquisitors, oracles, and warpriests who worship Apsu or Dahak add draconic ally to their spell lists as a 3rd-level spell.",Legacy Of Dragons,1,1,1,0,0,3,3,,,,,3,,3,,,,3,,,,3,,,0,0,0,0,0,0,0,0,0,0,0,0,0,0,0,0,0,0,0,0,0,0,0,0,0,,2613,250,,,,,0,3,,3,,,3,3,,,,,0,1,0,3
Scales Of Deflection,abjuration,,draconic,"bloodrager 2, magus 3, occultist 3, paladin 3, psychic 3, sorcerer/wizard 3, spiritualist 3, summoner/unchained summoner 3",1 standard action,"V, M (a dragon scale)",0,personal,,,you,1 minute/level (see text),0,0,,,"Brilliant draconic iconography matching your draconic heritage (or a kind of dragon whose alignment matches your own) surrounds you. Any touch attack attempted against you resolves against your normal AC. Once such an attack has been resolved, this spell is dismissed at the end of your next turn.",Legacy Of Dragons,1,0,1,0,0,3,3,,,,,3,,3,,,,,3,,,3,,,0,0,0,0,0,0,0,0,0,0,0,0,0,0,0,0,0,0,0,0,0,0,0,0,0,,2622,,,,,,0,2,,3,,,3,3,,,,,0,1,0,3
Tail Strike,transmutation,,draconic,"alchemist 4, antipaladin 3, bloodrager 3, medium 3, paladin 3, sorcerer/wizard 3",1 standard action,"V, M (a dragon scale)",0,personal,,,you,1 minute/level (see text),0,0,,,"You grow a draconic tail (clothing and armor adjust as necessary), or if you already have a tail, it takes on a draconic appearance. If you have a draconic bloodline, the tail matches the appearance of that dragon type; otherwise, it matches the appearance of a dragon type whose alignment matches your own. You gain a tail slam attack that deals 1d6 points of damage (1d4 if Small, 1d8 if Large) + your Strength modifier. If you already have a tail attack, you instead extend the reach of your tail attack by 5 feet. If you have a tail sweep attack, this spell increases its radius by 10 feet. If used as part of a full-attack action, the tail slam is considered a secondary attack, is made at your full base attack bonus - 5, and adds half your Strength modifier to its damage. You can end this spell before its normal duration by uttering a bestial roar as a swift action. When you do, you can attempt an Intimidate check to demoralize all foes within a 30-foot radius that can hear the roar. Clerics, inquisitors, oracles, and warpriests who worship dragon deities add tail strike to their class spell lists as a 4th-level spell.",Legacy Of Dragons,1,0,1,0,0,3,3,,,,,3,4,,,,,3,,,,3,,,0,0,0,0,0,0,0,0,0,0,0,0,0,0,0,0,0,0,0,0,0,0,0,0,0,,2623,,,,,,0,3,,,3,,,,,,,,0,1,0,
Ban Corruption,abjuration,,good,"cleric/oracle 5, inquisitor 4, medium 3, occultist 4, paladin 4, shaman 5",1 standard action,"V, S, F (a ceremonial dagger)",0,,30-ft.-radius emanation centered on you,,,"concentration plus 1 round/level, up to 1 hour/level",0,0,Will negates,yes,"You strip all creatures within the emanation of any gifts associated with corruptions (see page 14). Abilities associated with corruptions cease to function, as if they were magically dispelled. The corruption stains still fully affect creatures. A creature that enters the emanation and fails its saving throw loses its gifts until the spell's duration ends, even if it leaves the emanation, but a successful saving throw renders a creature immune to the spell, even if it enters and exits the emanation several times.",Horror Adventures,1,1,0,0,0,,,5,,,,4,,,,4,5,,,,,5,,Eliminate the gifts of nearby corrupted creatures.,0,0,0,0,0,0,0,0,0,0,0,0,0,0,0,1,0,0,0,0,0,0,0,0,0,,2629,,,,,,0,,5,,3,,4,,,,,,0,0,0,
Damnation,evocation,,good,"cleric/oracle 3, inquisitor 3, paladin 3",1 standard action,"V, S, M/DF (a drop of holy water)",0,,30-ft.-radius burst centered on you,,,instantaneous,0,0,Will half,yes,"You pass judgment on your enemies' intentions and punish them with holy power. Each creature in the spell's area takes 1d8 points of damage per spell level, determined by the most powerful effect with the evil descriptor either affecting that creature or in its spell repertoire. A caster who prepares spells takes this damage based on the highest-level evil spell he prepared that day, even if he already cast that spell. A spontaneous spellcaster takes this damage based on the highest-level evil spell she knows, even if she has no remaining spell slots available to cast that spell. A creature with evil spell-like abilities takes this damage based on the highest-level evil spell-like ability it can use. A creature who doesn't cast spells but is the willing beneficiary of evil spells takes this damage based on the highest-level evil spell currently affecting it, including spells that affect an area such as desecrate. A creature subject to the harmful effects of an evil spell are unaffected unless it voluntarily accepted the spell's effects.",Horror Adventures,1,1,1,0,1,,,3,,,,3,,,,3,3,,,,,3,,Punish creatures for evil spells they know or that affect them.,0,0,0,0,0,0,0,0,0,0,0,0,0,0,0,1,0,0,0,0,0,0,0,0,0,,2648,,,,,,0,,,,,,,,,,,,0,0,0,
Hedging Weapons,abjuration,,force,"antipaladin 1, cleric/oracle 1, inquisitor 1, paladin 1",1 standard action,"V, S, DF",0,personal,,,you,1 minute/level (D),1,0,,,"A weapon made from divine force appears and floats near you. This weapon takes the shape of your deity's favored weapon (if you have no deity, the weapon appears as a simple weapon with special significance to you). You gain one additional weapon at 6th level and every 4 caster levels thereafter-two at 6th, three at 10th, four at 14th, and a maximum of five weapons at 18th level. The weapon averts and deflects attacks, granting you a +1 deflection bonus to AC for each weapon summoned (maximum +5 at 18th level). As a standard action, you can grasp a weapon and throw it as a ranged attack at any target you can see within 30 feet of you (even if it's a type of weapon that can't normally be thrown). On a successful hit, the weapon deals 2d6 points of force damage to the target. This force weapon has the same threat range and critical multiplier as a standard weapon of its type, but no other special abilities. Because it deals force damage, DR doesn't apply. Each weapon thrown lowers the total deflection bonus to your AC by 1 as it disappears immediately after the attack action. The spell immediately ends once you throw all the weapons.",Horror Adventures,1,1,0,0,1,,,1,,,,1,,,,1,1,1,,,,1,,Floating weapons protect you and make ranged attacks.,0,0,0,0,0,0,0,0,0,0,0,0,0,0,1,0,0,0,0,0,0,0,0,0,0,,2659,,,,,,0,,,,,,,,,,,,0,0,0,
Holy Javelin,conjuration,creation,good,"cleric/oracle 3, inquisitor 3, paladin 2",1 standard action,"V, S, DF",0,medium (100 ft. + 10 ft./level),,javelin of divine energy,,1 round + 1 round/4 levels,0,0,none,yes,"You create a shimmering javelin of holy energy to hurl at an enemy as a ranged touched attack. The javelin deals 1d6 points of damage to an evil creature on a successful attack; it dissipates harmlessly against creatures of any other alignment. Each time a creature starts its turn while impaled by the javelin, it takes another 1d6 points of damage. For every 4 caster levels you have, the javelin remains in the creature for an additional round (to a maximum of 5 rounds at 18th level). While the creature remains impaled, it takes a -2 penalty on attack rolls and skill checks. As a move action, the creature (or another adjacent creature) can attempt to pull the javelin out (causing it to immediately disappear) with a DC 12 Strength check. The holy javelin glows like a torch, and this light clearly indicates the impaled creature's location, even if it turns invisible. Since this light is not a light effect, just the glow of a conjured javelin, darkness spells always suppress it, even if they are lower level.",Horror Adventures,1,1,0,0,1,,,3,,,,2,,,,3,3,,,,,3,,Deal ongoing damage to evil creatures and apply penalties.,0,0,0,0,0,0,0,0,0,0,0,0,0,0,0,1,0,0,0,0,0,0,0,0,0,,2660,,,,,,0,,,,,,,,,,,,0,0,0,
