name,school,subschool,descriptor,spell_level,casting_time,components,costly_components,range,area,effect,targets,duration,dismissible,shapeable,saving_throw,spell_resistence,description,source,verbal,somatic,material,focus,divine_focus,sor,wiz,cleric,druid,ranger,bard,paladin,alchemist,summoner,witch,inquisitor,oracle,antipaladin,magus,adept,deity,SLA_Level,domain,short_description,acid,air,chaotic,cold,curse,darkness,death,disease,earth,electricity,emotion,evil,fear,fire,force,good,language_dependent,lawful,light,mind_affecting,pain,poison,shadow,sonic,water,linktext,id,material_costs,bloodline,patron,mythic_text,augmented,mythic,bloodrager,shaman,psychic,medium,mesmerist,occultist,spiritualist,skald,investigator,hunter,haunt_statistics,ruse,draconic,meditative,summoner_unchained
Marks Of Forbiddance,abjuration,,mind-affecting,paladin 3,1 standard action,"V, S",0,close (25 ft. + 5 ft./2 levels),,,one enemy and one ally,1 round/level,0,0,Will negates; see text,yes,"Marks of Forbiddance magically brand two creatures, preventing them from committing violence against one another. When you cast this spell choose one enemy and one ally within range. Both targets become branded with the sigil of forbiddance. Until the end of the spell's duration, in order for the two targets to attack one another, even with a targeted spell, each attacker must attempt a Will save. If the save succeeds, that target can attack the other normally. If the save fails, the target can't follow through with the attack and the action is lost. This spell does not prevent the targets from attacking each other with area of effect spells or abilities.",APG,1,1,0,0,0,,,,,,,3,,,,,,,,,,3,,Makes 2 creatures pass Will saves in order to attack each other.,0,0,0,0,0,0,0,0,0,0,0,0,0,0,0,0,0,0,0,1,0,0,0,0,0,Marks Of Forbiddance,827,,,,,,0,,,,,,,,,,,,0,0,0,
Oath Of Peace,abjuration,,,paladin 4,1 standard action,"V, S",0,personal,,,you,1 round/level,0,0,,,"Entreating your deity for aid, you make a temporary oath of peace, granting you superior defenses but means you can't attack for the duration of the oath. For as long as you are subject to this spell, you gain a +5 sacred bonus to AC and on saving throws, as well as DR 10/evil. If you make a direct or indirect attack or any show any hostility toward any creature, the spell immediately ends.",APG,1,1,0,0,0,,,,,,,4,,,,,,,,,,4,,"Grants +5 AC and DR 10/evil, can’t attack.",0,0,0,0,0,0,0,0,0,0,0,0,0,0,0,0,0,0,0,0,0,0,0,0,0,Oath of Peace,835,,,,"You don't provoke attacks of opportunity when you attempt Heal checks, cast targeted spells with the harmless descriptor, or use positive energy effects to heal living creatures.",,1,,,,,,,,,,,,0,0,0,
Paladin's Sacrifice,abjuration,,,paladin 2,1 immediate action,"V, DF",0,close (25 ft. + 5 ft./2 levels),,,one creature,instantaneous,0,0,Fortitude negates (harmless),yes (harmless),"You open up a brief but powerful divine conduit between you and another creature, taking on the damage and any other effects that creature suffers. When a creature in range is hit by an attack or fails a saving throw, you can cast this spell and the wounds and/or effects are magically transmitted to you instead of the target. You are affected as if you were hit by the attack or failed the saving throw, taking all the damage and suffering all of the adverse effects. Any resistances or immunities you have are applied normally, but you cannot otherwise reduce or negate the damage or effects in any way. If you use this spell against an effect that also targets you or includes you in its area, you suffer the effects for both yourself and the target you spared, potentially taking damage or suffering other consequences twice.",APG,1,0,0,0,1,,,,,,,2,,,,,,,,,,2,,Take the damage and effects for another creature.,0,0,0,0,0,0,0,0,0,0,0,0,0,0,0,0,0,0,0,0,0,0,0,0,0,Paladin's Sacrifice,839,,,,,,0,,,,,,,,,,,,0,0,0,
Rally Point,enchantment,compulsion,"good, mind-affecting, emotion",paladin 1,1 standard action,"V, S, DF",0,5 ft.,one 5-ft. square,,,1 minute/level (D),1,0,Will negates (harmless),yes (harmless),"You create a spot that has the power to briefly hearten any good creature who comes into contact with it. A good creature who enters this square (even if simply as part of its normal move) gains a +2 morale bonus on attacks, saving throws, and 2 temporary hit points per caster level for 1 round. Nongood creatures gain no benefit from this spell. A creature cannot benefit more than once from the same casting of this spell.",APG,1,1,0,0,1,,,,,,,1,,,,,,,,,,1,,Square gives good creatures bonuses.,0,0,0,0,0,0,0,0,0,0,1,0,0,0,0,1,0,0,0,1,0,0,0,0,0,Rally Point,851,,,,,,0,,,,,,,,,,,,0,0,0,
Resounding Blow,evocation,,sonic,"antipaladin 4, inquisitor 5, paladin 4",1 swift action,V,0,personal,,,you,1 round/level,0,0,Fortitude partial; see text,no,"You must have a melee weapon in hand to cast this spell. On a successful melee attack, your weapon resounds with a thunderous clash. The target takes 1d6 points of sonic damage. Your weapon is not harmed by this attack. If you are using your judgment ability or smite ability against the target, it is staggered for 1 round on a successful attack. A successful Fortitude save negates the staggering effect. On a successful critical hit, the target is stunned for 1 round and deafened for 1d6 rounds. A successful Fortitude save negates the stunning and deafening effects. If you are also using judgment or smite, your foe makes only a single save against all effects. This spell immediately ends if your weapon leaves your hand. Resounding blow stacks with the thundering weapon property.",APG,1,0,0,0,0,,,,,,,4,,,,5,,4,,,,4,,Melee attack deals 1d6 more damage.,0,0,0,0,0,0,0,0,0,0,0,0,0,0,0,0,0,0,0,0,0,0,0,1,0,Resounding Blow,858,,,,,,0,,,,,,,,,,,,0,0,0,
Righteous Vigor,enchantment,compulsion,mind-affecting,"inquisitor 3, paladin 2",1 standard action,"V, S, DF",0,touch,,,creature touched,1 round/level,0,0,Will negates (harmless),yes (harmless),"Infusing the target with a surge of furious divine energy, you enhance a creature's ability to hit an opponent based on the number of times it has already hit that opponent with a successful attack. Each time the subject successfully strikes an opponent with a successful melee attack, the subject gains a cumulative +1 morale bonus on attack rolls (maximum +4 bonus) and gains 1d8 temporary hit points (to a maximum of 20 temporary hit points). If an attack misses, the attack bonus resets to +0 but any accumulated temporary hit points remain. The temporary hit points disappear at the end of the spell's duration.",APG,1,1,0,0,1,,,,,,,2,,,,3,,,,,,2,,Boosts attack bonus with each hit.,0,0,0,0,0,0,0,0,0,0,0,0,0,0,0,0,0,0,0,1,0,0,0,0,0,Righteous Vigor,864,,,,,,0,,,,,,,,,,,,0,0,0,
Sacred Bond,conjuration,healing,,"cleric/oracle 3, inquisitor 2, paladin 2",1 round,"V, S, F (a pair of golden bracelets worth 100 gp each worn by both you and the target)",1,touch; see text,,,creature touched,10 minutes/level (D),1,0,Will negates (harmless),yes (harmless),"To use this spell, you first touch the intended recipient, creating a sympathetic field of healing energies between you. Once the spell has been cast, you and the target may cast conjuration (healing) spells with a range of touch upon each other so long as you are within close range (25 ft. + 5 ft./2 levels). Should either you or the target remove your bracelet, the spell immediately ends.",APG,1,1,0,0,0,,,3,,,,2,,,,2,3,,,,,3,,Cast touch healing spells from a distance.,0,0,0,0,0,0,0,0,0,0,0,0,0,0,0,0,0,0,0,0,0,0,0,0,0,Sacred Bond,866,100,,,"The range at which you and the target can cast conjuration (healing) spells on each other increases to medium (100 feet + 10 feet per caster level). When you or the target uses the sacred bond to cast a healing spell on the other, the caster also heals a number of hit points equal to the minimum amount the spell can heal.","Augmented (6th): If you expend two uses of mythic power, casting a healing spell through the link heals the caster the normal amount instead of the minimum amount. You and the target can use the link to heal each other with targeted healing abilities such as lay on hands. Unlike with healing spells, a character using a healing ability in this way doesn't heal herself.",1,,,,,,,,,,,,0,0,0,
Sacrificial Oath,abjuration,,,paladin 4,1 standard action,"V, S, DF",0,touch,,,creature touched,1 minute/level,0,0,Fortitude negates (harmless),yes (harmless),"You create a powerful bond between yourself and a single creature. Until the end of the spell's duration, each time the target is hit with an attack or fails a saving throw, you can take the full damage of that attack and any other effects that creature suffers. If you choose not to take on the damage and effects, you instead take a number of points of damage equal to your Constitution score as backlash. Any resistances or immunities you have are applied normally, but you cannot otherwise reduce or negate the damage or effects of either the transfer or the backlash. If you or the subject of the spell move out of line of sight, the spell ends.",APG,1,1,0,0,1,,,,,,,4,,,,,,,,,,4,Martyr (6),Take damage for an ally for many rounds.,0,0,0,0,0,0,0,0,0,0,0,0,0,0,0,0,0,0,0,0,0,0,0,0,0,Sacrificial Oath,867,,,,,,0,,,,,,,,,,,,0,0,0,
Saddle Surge,transmutation,,,paladin 2,1 standard action,"V, S, DF",0,personal,,,you and your mount,1 round/level (D); see text,1,0,,,"You and your mount form a perfect synergy that endows both of you with advantages based upon how far you travel each round. For every 5 feet your mount moves in a given round, you gain a +1 competence bonus on Ride checks and both you and your mount gain a +1 morale bonus on damage rolls made with weapons or natural attacks for 1 round. For instance, if your mount traveled 40 feet in a round, you would gain a +8 bonus on Ride checks and you and your mount would both gain a +8 bonus on damage rolls for 1 round, to a maximum bonus equal to your caster level. You must be mounted to enjoy the benefits of this spell. If you dismount, get knocked off, or take any other action that separates you from your mount, the spell immediately ends.",APG,1,1,0,0,1,,,,,,,2,,,,,,,,,,2,,Bonus damage for moving on mount.,0,0,0,0,0,0,0,0,0,0,0,0,0,0,0,0,0,0,0,0,0,0,0,0,0,Saddle Surge,868,,,,,,0,,,,,,,,,,,,0,0,0,
Sanctify Armor,abjuration,,good,"inquisitor 4, paladin 3",1 standard action,"V, S",0,touch,,,armor touched,1 minute/level,0,0,"Will negates (harmless, object)","yes (harmless, object)","You imbue your armor with a righteous aura. It gains a +1 enhancement bonus per four caster levels (maximum +5 at 20th level). When using your judgment or smite ability, you gain DR 5/evil. An outfit of regular clothing counts as armor that grants no AC bonus for the purpose of this spell.",APG,1,1,0,0,0,,,,,,,3,,,,4,,,,,,3,,+1 AC/four levels (max +5).,0,0,0,0,0,0,0,0,0,0,0,0,0,0,0,1,0,0,0,0,0,0,0,0,0,Sanctify Armor,869,,,,"You gain DR 5/evil while wearing the target armor. While you're using your judgment or smite ability, this improves to DR 10/evil.","Augmented (3rd): If you expend two uses of mythic power, when you use judgment or smite, add half your tier to your AC as a sacred bonus.",1,,,,,,,,,,,,0,0,0,
Stay the Hand,enchantment,compulsion,mind-affecting,paladin 4,1 immediate action,"V, S, DF",0,medium (100 ft. + 10 ft./level),,,one creature,1/round per level and special; see text,0,0,Will partial,yes,"You cause a creature's arm to waver and prevent it from striking another creature. You can cast this spell when the target is about to make a melee attack against another creature. On a failed saving throw, the target does not follow through with its attack, and its entire action is wasted for the round. On a successful saving throw, the target can make its attack, forcing its strike though the compulsion but losing both accuracy and power, taking a -5 penalty on its attack and damage rolls. Whether or not the target makes its initial save or not, it is subject to a -2 penalty on attack and damage rolls against the creature it originally targeted for the duration of the spell.",APG,1,1,0,0,1,,,,,,,4,,,,,,,,,,4,,Subject cannot attack with melee weapon.,0,0,0,0,0,0,0,0,0,0,0,0,0,0,0,0,0,0,0,1,0,0,0,0,0,Stay the Hand,892,,,,,,0,,,,,,,,,,,,0,0,0,
Veil of Positive Energy,abjuration,,good,paladin 1,1 standard action,"V, S, DF",0,personal or 5 ft.; see text,,,you or all creatures within 5 ft.; see text,10 minutes/level (D),1,0,,,"You surround yourself with a veil of positive energy, making it harder for undead creatures to harm you. When under the effect of this spell, you gain a +2 sacred bonus to AC and a+2 sacred bonus on saves. Both of these bonuses apply only against attacks or effects created by undead creatures. You can dismiss this spell before its normal duration as a swift action on your turn to deal a number of points of positive energy damage equal to your level to all undead creatures within 5 feet of you.",APG,1,1,0,0,1,,,,,,,1,,,,,,,,,,1,,"+2 AC, +2 on saves vs. undead.",0,0,0,0,0,0,0,0,0,0,0,0,0,0,0,1,0,0,0,0,0,0,0,0,0,Veil of Positive Energy,924,,,,,,0,,,,,,,,,,,,0,0,0,
Wake of Light,evocation,,good,paladin 2,1 standard action,"V, S, DF",0,120 ft.,,"a 10-ft.-wide path in a straight line, up to 120 ft. long",,1 round/level,0,0,none,yes,"You and your mount lay down a trail of glowing, heavenly mist behind you as you move that makes passage easier for good creatures but more difficult for evil creatures. This glowing trail of mist appears behind your mount in a straight line starting where you cast the spell and ending where your mount ends its movement. The mist takes the form of a path 10 feet wide and up to 120 feet long and always floats just above the ground, up to a height of 1 foot. Thereafter, the mist persists for 1 round per level. Good creatures may walk along the top of the mist as if it were solid, treating squares of difficult terrain containing the mist as normal terrain. Evil creatures find the mist thick and cloying, and treat squares of normal terrain containing the mist as difficult terrain instead. Neutral creatures pass through the mist with no effect. The mist has no effect on obstacles or otherwise impassable terrain, and does not block sight or provide concealment. Except for very special circumstances (such as a celestial or fiendish mount), mounts use the alignment of their rider when determining how this spell affects them. You must be mounted to enjoy the benefits of this spell. If you dismount, get knocked off, or take any other action that separates you from your mount, the spell immediately ends, although the mist remains for the spell's normal duration. A wake of light cannot follow across water, underwater, or through the air in the case of a mount capable of walking on water, swimming, or flight.",APG,1,1,0,0,1,,,,,,,2,,,,,,,,,,2,,"Magical trail aids good creatures, hinders evil ones.",0,0,0,0,0,0,0,0,0,0,0,0,0,0,0,1,0,0,0,0,0,0,0,0,0,Wake of Light,929,,,,,,0,,,,,,,,,,,,0,0,0,
Weapon of Awe,transmutation,,emotion,"cleric/oracle 2, inquisitor 2, paladin 2, occultist 2",1 standard action,"V, S, DF",0,touch,,,weapon touched,1 minute/level,0,0,"Will negates (harmless, object)","yes (harmless, object)","You transform a single weapon into an awe-inspiring instrument. The weapon gains a +2 sacred bonus on damage rolls, and if the weapon scores a critical hit, the target of that critical hit becomes shaken for 1 round with no saving throw. This is a mind-affecting fear effect. A ranged weapon affected by this spell applies these effects to its ammunition. You can't cast this spell on a natural weapon, but you can cast it on an unarmed strike.",APG,1,1,0,0,1,,,2,,,,2,,,,2,2,,,,,2,,Weapon gets +2 on damage rolls.,0,0,0,0,0,0,0,0,0,0,1,0,0,0,0,0,0,0,0,0,0,0,0,0,0,Weapon of Awe,934,,,,,,0,,,,,,2,,,,,,0,0,0,
Wrathful Mantle,evocation,,"force, light","cleric/oracle 3, paladin 3",1 standard action,"V, S, DF",0,touch or 5 ft.; see text,,,creature touched or all creatures within 5 ft.; see text,1 minute/level,0,0,Will negates (harmless),yes (harmless),"A shimmering mantle of light shrouds the subject, light like a torch. The subject of the spell gains a +1 resistance bonus on all saving throws per four caster levels (maximum +5 at 20th level). The subject can end the wrathful mantle at any time as a swift action to deal 2d8 points of force damage to all creatures within 5 feet.",APG,1,1,0,0,1,,,3,,,,3,,,,,3,,,,,3,Hatred (2),Subject shines and gets +1/four levels on all saves.,0,0,0,0,0,0,0,0,0,0,0,0,0,0,1,0,0,0,1,0,0,0,0,0,0,Wrathful Mantle,938,,,,,,0,,,,,,,,,,,,0,0,0,
Blessing of Courage and Life,conjuration,healing,emotion,"cleric/oracle 2, paladin 2",1 standard action,"V, S, DF",0,close (25 ft. + 5 ft./2 levels),,,one living creature,1 minute/level (see below),0,0,Will negates (harmless),yes (harmless),"With this prayer you provide long-lasting succor to a wounded creature. For as long as the effect lasts, the target receives a +2 morale bonus on saving throws against fear and death effects. At any time while the spell is in effect, the target can choose to end the spell as a swift action for a burst of healing energy. The target loses the saving throw bonus, but is healed of 1d8 points of damage +1 point per caster level (maximum +10).",APG,1,1,0,0,1,,,2,,,,2,,,,,2,,,,,2,,Grants a +2 bonus on saves vs. fear and death.,0,0,0,0,0,0,0,0,0,0,1,0,0,0,0,0,0,0,0,0,0,0,0,0,0,Blessing of Courage and Life,944,,,Death (4),,,0,,,,,,,,,,,,0,0,0,
Shield Of The Dawnflower,evocation,,"fire, good, light","bard 4, cleric/oracle 4, magus 4, paladin 4, ranger 4",1 standard action,"V, S, DF",0,personal,,,you,1 round/level,0,0,see text,no,"You create a disk of sunlight on one arm. Any creature that strikes you with a melee attack deals normal damage, but also takes 1d6 points of fire damage + 1 point per caster level (maximum +15). Creatures with reach weapons are not subject to this damage if they attack you. The shield provides illumination as if it were a continual flame spell. You can only have one instance of this spell in effect at a time. It does not stack with similar damaging aura spells such as fire shield.",Inner Sea World Guide,1,1,0,0,1,,,4,,4,4,4,,,,,4,,4,,,4,,,0,0,0,0,0,0,0,0,0,0,0,0,0,1,0,1,0,0,1,0,0,0,0,0,0,Shield of the Dawnflower,959,,,,The disk of sunlight protects you as a buckler with a +1enhancement bonus per 4 caster levels (maximum +5).You can make a melee touch attack with your shield of theDawnflower in place of a normal attack to deal its fire damageto a creature. Creatures taking damage from your shield catch onfire (Reflex negates); the save DC to extinguish the fire is equalto the DC of the spell.,,1,,,,,,,,,,4,,0,0,0,
Unbreakable Heart,enchantment,compulsion,mind-affecting,"bard 1, cleric/oracle 1, paladin 1, ranger 1, witch 1",1 standard action,"V, S",0,close (25 ft. + 5 ft./2 levels),,1 creature,,1 round/level,0,0,Will negates (harmless),yes (harmless),"The target creature gains a +4 morale bonus on saving throws against mind-affecting effects that rely on negative emotions (such as crushing despair, rage, or fear effects) or that would force him to harm an ally (such as confusion). If the target is already under such an effect when receiving this spell, that effect is suppressed for the duration of this spell. It does not affect mind-affecting effects based on positive emotions (such as good hope or the inspire courage bard ability). A creature can still be charmed or otherwise magically controlled while under this spell's effects, but if such a creature ever receives a new saving throw against that effect as a result of being ordered to attempt to harm or otherwise oppose a true ally, he can roll that saving throw twice and take the better result as his actual roll. Calm emotions counters and dispels unbreakable heart.",Inner Sea World Guide,1,1,0,0,0,,,1,,1,1,1,,,1,,1,,,,,1,,,0,0,0,0,0,0,0,0,0,0,0,0,0,0,0,0,0,0,0,1,0,0,0,0,0,Unbreakable Heart,961,,,,,,0,,,,,,,,,,1,,0,0,0,
Archon's Aura,evocation,,"good, lawful","cleric/oracle 3, paladin 3",1 standard action,"V, S",0,20 ft.,20-ft. radius centered on you,,,1 minute/level,0,0,Will negates,yes,"You gain a powerful aura, similar to an archon's aura of menace. Any hostile creature within a 20-foot radius of you must make a Will save to resist the effects of this aura. If the creature fails, it takes a -2 penalty on attack rolls and saving throws and to Armor Class for the duration of this spell, or until it successfully hits you with an attack. A creature that has resisted or broken the cannot be affected again by this particular casting of archon's aura.",Ultimate Magic,1,1,0,0,0,,,3,,,,3,,,,,3,,,,,3,,Aura penalizes enemy attacks and AC.,0,0,0,0,0,0,0,0,0,0,0,0,0,0,0,1,0,1,0,0,0,0,0,0,0,Archon's Aura,986,,,,,,0,,,,,,,,,,,,0,0,0,
Arrow of Law,evocation,,lawful,"cleric/oracle 2, paladin 2",1 standard action,"V, S, DF (a holy symbol)",0,close (25 ft. + 5 ft./2 levels),,arrow-shaped projectile of lawful energy,,instantaneous (1 round); see text,0,0,Will partial (see text),yes,"You fire a shimmering arrow of pure order from your holy symbol at any one target in range as a ranged touch attack. A chaotic creature struck by an arrow of law takes 1d8 points of damage per two caster levels (maximum 5d8). A chaotic outsider instead takes 1d6 points of damage per caster level (maximum 10d6) and is dazed for 1 round. A successful Will save reduces the damage to half and negates the daze effect. This spell deals only half damage to creatures that are neither chaotic nor lawful, and they are not dazed. The arrow has no effect on lawful creatures.",Ultimate Magic,1,1,0,0,1,,,2,,,,2,,,,,2,,,,,2,,Harm and possibly daze chaotic creatures.,0,0,0,0,0,0,0,0,0,0,0,0,0,0,0,0,0,1,0,0,0,0,0,0,0,Arrow of Law,987,,,,,,0,,,,,,,,,,,,0,0,0,
Bestow Grace of the Champion,transmutation,,"good, law","cleric/oracle 7, paladin 4",1 standard action,"V, S, DF",0,touch,,,lawful good creature touched,1 round/level (see text),0,0,yes (harmless),yes (harmless),"You channel the power of good and law into the target, temporarily giving it powers similar to those of a paladin. The target gains the ability to use detect evil at will as a spell-like ability, immunity to disease (suppressing any diseases currently affecting it), and immunity to fear (ending any fear effects currently affecting it); can lay on hands (on itself only) once as a paladin of 1/2 your caster level; and can smite evil once as a paladin of 1/2 your caster level. It adds its Charisma bonus to all its saving throws. It can use spell completion, spell trigger, or other magic items that require the ability to cast spells as a paladin. Any abilities not used by the time the spell expires are lost. This spell has no if cast on a paladin.",Ultimate Magic,1,1,0,0,1,,,7,,,,4,,,,,7,,,,,7,,Target gains paladin abilities for 1 round/level.,0,0,0,0,0,0,0,0,0,0,0,0,0,0,0,1,0,0,0,0,0,0,0,0,0,Bestow Grace of the Champion,995,,,Devotion (14),,,0,,,,,,,,,,,,0,0,0,
Blade of Bright Victory,transmutation,,good,paladin 3,1 standard action,"V, S",0,touch,,,your paladin bonded weapon,1 minute/level,0,0,Will negates (harmless),no,"You strengthen the bond between your divine bond weapon and its celestial spirit. The weapon gains the ghost touch property. You may change your weapon's damage type (bludgeoning, piercing, slashing) as a swift action. You gain a sacred bonus to your CMD against disarm and sunder attacks directed at your bonded weapon; this bonus is equal to half your caster level.",Ultimate Magic,1,1,0,0,0,,,,,,,3,,,,,,,,,,3,,Bonded weapon gains ghost touch.,0,0,0,0,0,0,0,0,0,0,0,0,0,0,0,1,0,0,0,0,0,0,0,0,0,Blade of Bright Victory,996,,,,,,0,,,,,,,,,,,,0,0,0,
Blessing of the Mole,transmutation,,,"cleric/oracle 3, inquisitor 3, paladin 3, ranger 3",1 round,"V, S",0,close (25 ft. + 5 ft./2 levels),1 creature/level,,,1 minute/level,0,0,none (harmless),yes (harmless),The targets gain darkvision 30 feet and a +2 competence bonus on Stealth checks.,Ultimate Magic,1,1,0,0,0,,,3,,3,,3,,,,3,3,,,,,3,,1 ally/level gains darkvision and a +2 Stealth bonus.,0,0,0,0,0,0,0,0,0,0,0,0,0,0,0,0,0,0,0,0,0,0,0,0,0,Blessing of the Mole,998,,,,,,0,,,,,,,,,,3,,0,0,0,
Diagnose Disease,divination,,,"cleric/oracle 1, druid 1, paladin 1, ranger 1, witch 1, occultist 1, psychic 1, mesmerist 1",1 standard action,"V, S",0,close (25 ft. + 5 ft./2 levels),"one creature, one object, or a 5-ft. cube",,"one creature, one object, or a 5-ft. cube",instantaneous,0,0,none,no,"You determine whether a creature, object, or area carries any sort of disease or infestation (including molds, slimes, and similar hazards), or any exceptional or supernatural effects causing the sickened or nauseated effects. If there is disease present, you know what disease it is and its effects. If the target is a creature, you gain a +4 bonus on Heal checks to treat the creature's disease. The spell can penetrate many barriers, but 1 foot of stone, 1 inch of common metal, a thin sheet of lead, or 3 feet of wood or dirt blocks it.",Ultimate Magic,1,1,0,0,0,,,1,1,1,,1,,,1,,1,,,,,1,,Detect and identify diseases.,0,0,0,0,0,0,0,0,0,0,0,0,0,0,0,0,0,0,0,0,0,0,0,0,0,Diagnose Disease,1037,,,,,,0,,,1,,1,1,,,,1,,0,0,0,
