name,school,subschool,descriptor,spell_level,casting_time,components,costly_components,range,area,effect,targets,duration,dismissible,shapeable,saving_throw,spell_resistence,description,source,verbal,somatic,material,focus,divine_focus,sor,wiz,cleric,druid,ranger,bard,paladin,alchemist,summoner,witch,inquisitor,oracle,antipaladin,magus,adept,deity,SLA_Level,domain,short_description,acid,air,chaotic,cold,curse,darkness,death,disease,earth,electricity,emotion,evil,fear,fire,force,good,language_dependent,lawful,light,mind_affecting,pain,poison,shadow,sonic,water,linktext,id,material_costs,bloodline,patron,mythic_text,augmented,mythic,bloodrager,shaman,psychic,medium,mesmerist,occultist,spiritualist,skald,investigator,hunter,haunt_statistics,ruse,draconic,meditative,summoner_unchained
"Blessing Of Luck And Resolve, Mass",enchantment,compulsion,mind-affecting,"cleric/oracle 6, inquisitor 6, paladin 4",1 standard action,"V, S",0,close (25 ft. + 5 ft./2 levels),,,"one creature/level, no two of which can be more than 30 ft. apart","1 minute/level (D), special see below",1,0,Will negates (harmless),yes (harmless),"This spell functions like blessing of luck and resolve, except that it affects multiple creatures.",Advanced Race Guide,1,1,0,0,0,,,6,,,,4,,,,6,6,,,,,6,,,0,0,0,0,0,0,0,0,0,0,0,0,0,0,0,0,0,0,0,1,0,0,0,0,0,,1503,,,,,,0,,,,,,,,,,,,0,0,0,
Sacred Space,evocation,,good,"cleric/oracle 2, paladin 2",1 standard action,"V, S, M (a vial of ambrosia)",0,close (25 ft. + 5 ft./2 levels),20-ft.-radius emanation,,,2 hours/level,0,0,none,no,"This spell sanctifies an area with heavenly power. The DC to resist spells or spell-like abilities with the good descriptor or channeled energy that damages evil outsiders (as when using Alignment Channel) increases by +2. In addition, evil outsiders take a -1 penalty on attack rolls, damage rolls, and saving throws, and they cannot be called or summoned into a sacred space. If the sacred space contains an altar, shrine, or other permanent fixture dedicated to your deity, pantheon, or good-aligned higher power, the modifiers given above are doubled. You cannot cast sacred space in an area with a permanent fixture dedicated to a deity other than yours.",Advanced Race Guide,1,1,1,0,0,,,2,,,,2,,,,,2,,,,,2,,,0,0,0,0,0,0,0,0,0,0,0,0,0,0,0,1,0,0,0,0,0,0,0,0,0,,1510,,,,,,0,,,,,,,,,,,,0,0,0,
Veil Of Heaven,abjuration,,good,paladin 1,1 standard action,"V, S, DF",0,personal or 5 ft.; see text,,,you or all creatures within 5 ft.; see text,10 minutes/level (D),1,0,Will half,none,"You surround yourself with a veil of positive energy, making it harder for evil outsiders to harm you. For the duration of this spell, you gain a +2 sacred bonus to AC and on saves. Both of these bonuses apply only against attacks or effects created by outsiders with the evil subtype. You can dismiss this spell as a swift action to deal 1d8 points of damage + 1 point per paladin level to all such outsiders within 5 feet. A Will save halves this damage.",Advanced Race Guide,1,1,0,0,1,,,,,,,1,,,,,,,,,,1,,,0,0,0,0,0,0,0,0,0,0,0,0,0,0,0,1,0,0,0,0,0,0,0,0,0,,1512,,,,,,0,,,,,,,,,,,,0,0,0,
Blinding Ray,evocation,,"good, light","cleric/oracle 2, inquisitor 3, paladin 2",1 standard action,"V, S, DF",0,close (25 ft. + 5 ft./2 levels),,one or more rays of light,,instantaneous (see text),0,0,Fortitude negates,yes,"You blast your enemies with blinding rays of sunlight. You may fire one ray, plus one additional ray for every four levels beyond 3rd (to a maximum of three rays at 11th level). Each ray requires a ranged touch attack to hit. If a ray hits, it explodes into powerful motes of light, and the target must save or be blinded for 1 round. If the target has light blindness, light sensitivity, or is otherwise vulnerable to bright light, it instead must save or be blinded for 1d4 rounds and take 1d4 points of damage per two caster levels (maximum 5d4). Any creature blinded by a ray sheds light as a sunrod for the duration of its blindness. The rays may be fired at the same or different targets, but all rays must be aimed at targets within 30 feet of each other and fired simultaneously.",Advanced Race Guide,1,1,0,0,1,,,2,,,,2,,,,3,2,,,,,2,,,0,0,0,0,0,0,0,0,0,0,0,0,0,0,0,1,0,0,1,0,0,0,0,0,0,,1515,,,,"On a successful saving throw, the target is dazzled for 1 round. On a failed saving throw, the target is instead blinded for 1d4 rounds. A target with light blindness, light sensitivity, or any other vulnerability to light is instead blinded for 1d4 rounds on a successful saving throw and permanently blinded on a failed saving throw.",,1,,,,,,,,,,,,0,0,0,
Delay Disease,conjuration,healing,,"alchemist 2, cleric/oracle 2, druid 2, inquisitor 2, paladin 2, ranger 2, witch 1, mesmerist 2",1 standard action,"V, S, DF",0,touch,,,creature touched,1 day,0,0,Fortitude negates (harmless),yes (harmless),"The target becomes temporarily immune to disease. Any disease to which it is exposed during the spell's duration does not affect the target until the spell's duration has expired. If the target is currently infected with a disease, you must make a caster level check against the disease's DC to suspend it for the duration of the spell; otherwise, that disease affects the target normally. Delay disease does not cure any damage a disease may have already done.",Advanced Race Guide,1,1,0,0,1,,,2,2,2,,2,2,,1,2,2,,,,,2,,,0,0,0,0,0,0,0,0,0,0,0,0,0,0,0,0,0,0,0,0,0,0,0,0,0,,1545,,,,,,0,,,,,2,,,,,2,,0,0,0,
Bed Of Iron,necromancy,,,"inquisitor 1, magus 1, paladin 1, sorcerer/wizard 1",1 standard action,"V, S, M (a feather or swatch of soft fabric)",0,touch,,,one creature touched/level,8 hours,0,0,Fortitude negates (harmless),yes (harmless),This spell makes even the clunkiest armor feel soft as silk to the wearer. The subjects of this spell are able to sleep comfortably in medium or heavy armor without suffering from fatigue the following day.,Knights Of The Inner Sea,1,1,1,0,0,1,1,,,,,1,,,,1,,,1,,,1,,,0,0,0,0,0,0,0,0,0,0,0,0,0,0,0,0,0,0,0,0,0,0,0,0,0,,1582,,,,,,0,,,,,,,,,,,,0,0,0,
Carry Companion,transmutation,,,"druid 2, paladin 2, ranger 2, sorcerer/wizard 2, witch 2",1 standard action,"V, S, M (a pinch of sand or limestone dust)",0,touch,,,one willing creature touched,permanent; see text,0,0,none,yes (harmless),"You touch an animal or magical beast that has a helpful attitude toward you, instantly transforming the creature into a miniature figurine of stone, small enough to fit into the palm of your hand. Creatures with an attitude of less than helpful will not tolerate this spell, and it automatically fails to work on them. An intelligent animal or magical beast must be a willing subject in order for this spell to take effect. Any items that the creature wears (such as a harness or saddle) or carries (such as those stowed in saddlebags) are transformed along with the creature. While miniaturized, the creature is under an effect similar to that of a flesh to stone spell: It is mindless and inert, and does not seem alive when viewed with spells like deathwatch. However, you may return the creature to its normal form at any time simply by placing the figurine on the ground, touching it, and uttering a word of command. Otherwise, the creature remains in miniature form unless the spell is broken, such as by dispel magic or stronger magic. Unlike a flesh to stone spell, a creature affected by carry companion is unaffected by stone to flesh. If the miniature figurine is broken or damaged, the creature (if returned to its original state) has similar damage or deformities.",Knights Of The Inner Sea,1,1,1,0,0,2,2,,2,2,,2,,,2,,,,,,,2,,,0,0,0,0,0,0,0,0,0,0,0,0,0,0,0,0,0,0,0,0,0,0,0,0,0,,1583,,,,,,0,,,,,,,,,,2,,0,0,0,
Emblazon Crest,transmutation,,,"magus 1, paladin 1, sorcerer/wizard 1",1 standard action,"S, F (an example of the crest or coat of arms)",0,touch,,,creature touched,1 hour/level,0,0,Will negates (harmless),yes (harmless),"This spell ensures the subject touched is always able to display her proper crest and coat of arms. Any tabard or tunic worn and any shield carried by the subject while this spell is active can be made to display a coat of arms when the spell is cast. For example, even if the subject picks up a different shield, it still displays the subject's crest, regardless of the shield's normal appearance.",Knights Of The Inner Sea,0,1,0,0,0,1,1,,,,,1,,,,,,,1,,,1,,,0,0,0,0,0,0,0,0,0,0,0,0,0,0,0,0,0,0,0,0,0,0,0,0,0,,1585,,,,,,0,,,,,,,,,,,,0,0,0,
Keep Watch,enchantment,,,"inquisitor 1, magus 1, paladin 1, ranger 1, sorcerer/wizard 1",1 standard action,"V, S",0,touch,,,one creature touched/2 levels,8 hours or less; see text,0,0,Will negates (harmless),yes (harmless),"This spell enables the subjects to stand watch or keep vigil throughout the night without any ill effects. The subjects suffer no fatigue and gain all the usual benefits of a full night's rest. The subjects gain hit points as though from resting, wizards may prepare their spells as though they had slept for 8 hours, and so on. Effects that rely on actual sleep or dreaming are ineffective, though the subjects are still susceptible to effects that would put them to sleep, such as sleep or deep slumber. Any vigorous activity, including fighting, immediately ends the effect, and the affected creatures must either have the spell cast on them again or sleep for the remaining hours to avoid fatigue and gain the benefits of a full night's rest.",Knights Of The Inner Sea,1,1,0,0,0,1,1,,,1,,1,,,,1,,,1,,,1,,,0,0,0,0,0,0,0,0,0,0,0,0,0,0,0,0,0,0,0,0,0,0,0,0,0,,1586,,,,,,0,,,,,,,,,,1,,0,0,0,
Serren's Swift Girding,transmutation,,,"magus 1, paladin 1, sorcerer/wizard 1",1 standard action,"V, S, M (the armor to be worn)",0,close (25 feet + 5 feet/level),,,one willing creature/level,instantaneous,0,0,none,yes (harmless),"With a sweep of your hand, you select a number of targets and the same number of suits of armor. The targets of this spell are immediately clad in the armor that you choose. The subjects of the spell must be capable of wearing the chosen armor, cannot be wearing other armor, and must be able to properly fit into the chosen armor. The chosen armor must be empty and cannot be currently worn by another creature (thus you cannot move armor from one wearer to another with this spell). Creatures armored with this spell are considered to have donned the armor properly.",Knights Of The Inner Sea,1,1,1,0,0,1,1,,,,,1,,,,,,,1,,,1,,,0,0,0,0,0,0,0,0,0,0,0,0,0,0,0,0,0,0,0,0,0,0,0,0,0,,1588,,,,,,0,,,,,,,,,,,,0,0,0,
Oath Of Justice,necromancy,,,"cleric/oracle 3, paladin 2",1 standard action,"V, S, DF",0,touch,,,two creatures touched,permanent (see text),0,0,none,no,"This spell seals a solemn vow between two creatures. When this spell is cast, the targets must clasp hands and swear their oath in Kols's name. The spell functions like mark of justice, except as noted above and rather than being cursed, the oath-breaker gains a mark on the face indicating to all dwarves who see it that the target has broken a sacred oath, which gives the oath-breaker a -4 penalty to influence dwarves. The mark can be removed as described in the mark of justicespell, or the other target can forgive the oath- breaker, which causes the mark to vanish.",Dwarves of Golarion,1,1,0,0,1,,,3,,,,2,,,,,3,,,,Kols,3,,,0,0,0,0,0,0,0,0,0,0,0,0,0,0,0,0,0,0,0,0,0,0,0,0,0,,1628,,,,,,0,,,,,,,,,,,,0,0,0,
Tactical Formation,abjuration,,,"cleric/oracle 3, paladin 3, ranger 4",1 standard action,"V, S",0,close (25 ft. + 5 ft./2 levels),"up to one creature/level, no two of which may be more than 30 ft. apart",,,10 minutes/level,0,0,Will negates (harmless),yes (harmless),"This spell increases the effectiveness of a group's formation in battle. When cast, all creatures under the effect of the spell must be adjacent to one another, forming an unbroken chain of squares (which may include creatures sharing the same square). This chain does not need to be a straight line. Each target in the chain receives a +2 defection bonus to AC as long as the targets stay adjacent to at least one other creature affected by the spell; moving more than 5 feet from another target ends the spell with respect to that creature only. For example, a cleric could cast it on himself and four dwarves blocking a 20-foot-wide corridor; the cleric can move freely from the left side of the formation to the right side (whether in front of or behind the other targets) and not break the spell as long as he stays within 5 feet of at least one of them.",Dwarves of Golarion,1,1,0,0,0,,,3,,4,,3,,,,,3,,,,Torag,3,,,0,0,0,0,0,0,0,0,0,0,0,0,0,0,0,0,0,0,0,0,0,0,0,0,0,,1629,,,,,,0,,,,,,,,,,4,,0,0,0,
Soothing Word,conjuration,healing,,"cleric/oracle 2, druid 2, inquisitor 2, paladin 2, ranger 3, witch 2",1 standard action,"V, S",0,close (25 ft. + 5 ft./2 levels),,,1 creature,instantaneous,0,0,Will negates (harmless),yes (harmless),"The target of this spell causes several conditions that he suffers from to be lessened in severity one step. If he is nauseated, he is instead sickened. If he is stunned, he is instead dazed. If he is exhausted, he is fatigued. If he is frightened, he is shaken. If he is paralyzed, he is staggered. The duration of the effect is unchanged; the effect is simply reduced to the lesser version. This spell has no effect on conditions not listed above.",Condition Cards,1,1,0,0,0,,,2,2,3,,2,,,2,2,2,,,,,2,,,0,0,0,0,0,0,0,0,0,0,0,0,0,0,0,0,0,0,0,0,0,0,0,0,0,,1630,,,,,,0,,,,,,,,,,2,,0,0,0,
Accept Affliction,conjuration,healing,good,"bard 3, cleric/oracle 3, druid 3, paladin 3, witch 3",1 standard action,"V, S, M/DF (dove's heart)",0,touch,,,creature touched,instantaneous,0,0,Fortitude negates (harmless),yes (harmless),"The caster can transfer the effects of afflictions such as curses, diseases, and poisons from the target creature to himself. This spell can also transfer the blinded, deafened, fatigued, nauseated, shaken, and sickened conditions. All aspects of the transferred afflictions (save DCs, remaining duration, removal conditions, and so on) remain the same, but affect the caster instead of the original target. After transferring the affliction or condition, the caster is free to cure it in any way he can.",Champions Of Purity,1,1,1,0,1,,,3,3,,3,3,,,3,,3,,,,,3,,,0,0,0,0,0,0,0,0,0,0,0,0,0,0,0,1,0,0,0,0,0,0,0,0,0,,1632,,,,,,0,,,,,,,,,,3,,0,0,0,
"Angelic Aspect, Lesser",transmutation,,good,"cleric/oracle 2, paladin 2, sorcerer/wizard 2",1 standard action,"V, S",0,personal,,,you,1 minute/level (D),1,0,none,no,"You take on an aspect of an angelic being, including some of its physical characteristics. You gain low-light vision, resistance to acid 5, resistance to cold 5, and the benefits of protection from evil.",Champions Of Purity,1,1,0,0,0,2,2,2,,,,2,,,,,2,,,,,2,,,0,0,0,0,0,0,0,0,0,0,0,0,0,0,0,1,0,0,0,0,0,0,0,0,0,,1633,,,,,,0,,,,,,,,,,,,0,0,0,
"Angelic Aspect, Greater",transmutation,,good,"cleric/oracle 8, paladin 4, sorcerer/wizard 8",1 standard action,"V, S",0,personal,,,you,1 minute/level (D),1,0,none,no,"This spell functions like lesser angelic aspect, except you gain low-light vision; darkvision 60 feet; DR 10/evil; immunity to acid, cold, and petrification; resistance to electricity 10 and fire 10; a +4 racial bonus on saves against poison; and protective aura and truespeech as supernatural abilities for the duration of the spell. Also, your wings give you a fly speed of 60 feet with good maneuverability. Protective aura provides a +4 deflection bonus to AC and a +4 resistance bonus on saving throws against attacks made or effects created by evil creatures to anyone within 20 feet. Otherwise, it functions as a magic circle against evil and a lesser globe of invulnerability, both with a radius of 20 feet. Truespeech allows you to speak with any creature that has a language, as though using the tongues spell.",Champions Of Purity,1,1,0,0,0,8,8,8,,,,4,,,,,8,,,,,8,,,0,0,0,0,0,0,0,0,0,0,0,0,0,0,0,1,0,0,0,0,0,0,0,0,0,,1634,,,,,,0,,,,,,,,,,,,0,0,0,
Angelic Aspect,transmutation,,good,"cleric/oracle 5, paladin 3, sorcerer/wizard 5",1 standard action,"V, S",0,personal,,,you,1 minute/level (D),1,0,none,no,"This spell functions like lesser angelic aspect, except you gain low-light vision, darkvision 60, resistance to acid 10, resistance to cold 10, and DR 5/evil, and you sprout white feathered wings allowing you to fly at a speed of 30 feet with average maneuverability. In addition, your natural weapons and any weapons you wield are considered good-aligned for the purpose of overcoming damage reduction.",Champions Of Purity,1,1,0,0,0,5,5,5,,,,3,,,,,5,,,,,5,,,0,0,0,0,0,0,0,0,0,0,0,0,0,0,0,1,0,0,0,0,0,0,0,0,0,,1635,,,,,,0,,,,,,,,,,,,0,0,0,
Archon's Trumpet,evocation,,"good, sonic","bard 5, cleric/oracle 7, paladin 4, sorcerer/wizard 7",1 standard action,"V, S",0,30 ft.,cone-shaped burst,,,instantaneous,0,0,Fortitude negates,yes,"Upon hearing a booming report, as if from a trumpet archon's mighty horn, all creatures in the area of the burst are paralyzed for 1d4 rounds.",Champions Of Purity,1,1,0,0,0,7,7,7,,,5,4,,,,,7,,,,,7,,,0,0,0,0,0,0,0,0,0,0,0,0,0,0,0,1,0,0,0,0,0,0,0,1,0,,1636,,,,,,0,,,,,,,,,,,,0,0,0,
Chains Of Light,conjuration,creation,good,"cleric/oracle 6, inquisitor 5, paladin 4, sorcerer/wizard 6",1 standard action,"V, S, F (a length of fine golden chain)",0,short (25 ft. + 5 ft./level),,,one creature,1 round/level (D),1,0,Reflex negates,no,"A creature targeted by this spell is held immobile by glowing golden chains composed of pure light. The creature is paralyzed and held in place, but may attempt a new saving throw each round to end the effect. While held by the golden chains, a creature cannot use any sort of extradimensional travel, such as astral projection, blink, dimension door, ethereal jaunt, etherealness, gate, maze, plane shift, shadow walk, teleport, and similar spells and spell-like abilities. The spell does not affect creatures that are already in ethereal or astral form when the spell is cast.",Champions Of Purity,1,1,0,0,0,6,6,6,,,,4,,,,5,6,,,,,6,,,0,0,0,0,0,0,0,0,0,0,0,0,0,0,0,1,0,0,0,0,0,0,0,0,0,,1638,,,,,,0,,,,,,,,,,,,0,0,0,
Sanctify Weapons,transmutation,,,"cleric/oracle 5, paladin 3",1 standard action,"V, S, DF",0,close (25 ft. + 5 ft./2 levels),20-ft.-radius spread,,,1 round/level,0,0,"Will negates (harmless, object)","yes (harmless, object)","This spell originated among the armies of Heaven. Choose a specific subtype of evil outsider when you cast this spell, such as daemon, demon, devil, or div. All manufactured weapons in the area of effect bypass the DR of that type of outsider. The weapons do not become aligned or change composition.",Chronicle Of The Righteous,1,1,0,0,1,,,5,,,,3,,,,,5,,,,,5,,,0,0,0,0,0,0,0,0,0,0,0,0,0,0,0,0,0,0,0,0,0,0,0,0,0,,1645,,,,,,0,,,,,,,,,,,,0,0,0,
Burst With Light,evocation,,light,"cleric/oracle 4, paladin 4",1 standard action,"V, S",0,close (25 ft. + 5 ft./2 levels),,,one creature,1 round/4 levels,0,0,see text,yes,"The target becomes filled with intense magical light, taking 2d6 points of damage as the light bursts from its wounds and orifices (if the target is an undead creature, it instead takes 2d8 points of damage). In addition, the creature radiates bright light in a 30-foot radius and increases the light level by one step for an additional 30 feet beyond that area-darkness becomes dim light, dim light becomes normal light, and normal light becomes bright light. Creatures that take penalties in bright light take them while within the 30-foot radius of this magical light. A successful Will save halves the damage and negates the light effect. For every 4 character levels you possess, the light continues to fill the creature for another round (to a maximum of 5 rounds at 20th level), though the target may make a Will save each round to halve the damage and end the effect. Any creature adjacent to the target that fails its save and takes damage takes half as much damage and is blinded for 1 round. A successful Reflex save halves this damage (to a total of one-quarter the damage taken by the target) and negates the blindness effect.",Demon Hunter's Handbook,1,1,0,0,0,,,4,,,,4,,,,,4,,,,,4,,,0,0,0,0,0,0,0,0,0,0,0,0,0,0,0,0,0,0,1,0,0,0,0,0,0,,1690,,,,,,0,,,,,,,,,,,,0,0,0,
Detect Demon,divination,,,"cleric/oracle 1, inquisitor 1, paladin 1",1 standard action,"V, S, DF",0,60 ft.,cone-shaped emanation,,,"concentration, up to 10 minutes/level (D)",1,0,none (see text),no,"You sense the presence of a specific kind of evil-that of demons, their servants, and the Abyss. The amount of information revealed depends on how long you study a particular area or subject. 1st Round: Presence or absence of creatures with the demon subtype, creatures possessed by demons, creatures under the effects of spells or spell-like abilities cast by demons, or creatures otherwise tainted by demons. Creatures tainted by demons include tieflings with demonic heritages, sorcerers with abyssal bloodlines, creatures affected by a succubus's profane gift, creatures with demonic implants (see page 44 of Pathfinder Campaign Setting: Lords of Chaos, Book of the Damned, Vol. 2), or creatures who have the Demonic Obedience feat (Lords of Chaos 8), and those under significant demonic influence as determined by the GM. This spell does not detect creatures of chaotic evil alignment who are not demons or significantly influenced by demons. Additionally, this spell detects whether or not a portal or similar magical passage leads to the Abyss. 2nd Round: Number of evil auras shed by creatures with the demon subtype in the area, as well as the power of the most potent evil aura present. If you are of good alignment, and the strongest evil aura's strength is overwhelming; if the creature has HD equal to at least twice your character level, you are stunned for 1 round and the spell ends. 3rd Round: The power and location of each aura, and what demon lord, if any, a demon is most closely affiliated with. If an aura is outside your line of sight, you discern the direction but not its exact location. Affiliation to a demon lord is only revealed when the creature detected is a demon (not merely a creature tainted by a demon). Demons receive a Will saving throw to resist revealing what demon lord they are affiliated with. If the demon succeeds at this saving throw or is not forsworn to a demon lord, you know only that this aspect of the spell returned no information. Aside from what is detailed above, this spell otherwise functions similarly to detect evil in terms of aura power, lingering auras, overwhelming auras, and so forth.",Demon Hunter's Handbook,1,1,0,0,1,,,1,,,,1,,,,1,1,,,,,1,,,0,0,0,0,0,0,0,0,0,0,0,0,0,0,0,0,0,0,0,0,0,0,0,0,0,,1691,,,,,,0,,,,,,,,,,,,0,0,0,
Protection From Outsiders,abjuration,,see text,"cleric/oracle 2, inquisitor 2, paladin 2",1 standard action,"V, S, DF",0,touch,,,creature touched,1 minute/level (D),1,0,Will negates (harmless),no; see text,"This spell wards a creature from attacks by outsiders with a specific racial subtype, from mental control exerted by creatures of the chosen subtype, and from summoned creatures of that subtype. Only the subtypes of specific outsider races-angel, azata, demon, oni, psychopomp, protean, and so on-can be chosen as the subtype this spell protects against. Alignment subtypes or other general subtypes (like elemental, extraplanar, or native) cannot be selected. Outsiders without an outsider racial subtype (like genies, night hags, yeth hounds, or xills) are not affected by this spell. This spell creates a magical barrier around the subject at a distance of 1 foot. The barrier moves with the subject and has three major effects. First, the subject gains a +4 deflection bonus to AC and a +4 resistance bonus on saves when targeted by creatures of the chosen subtype. Second, the subject immediately receives another saving throw (if one was allowed to begin with) against any spells or effects that possess or exercise mental control over the target creature. This functions in the same fashion as protection from evil, but only when the effect stems from outsiders of the chosen subtype, and the target's saving throw is made with a +4 morale bonus (using the same DC as the original effect). Third, the spell prevents bodily contact by summoned creatures of the chosen subtype in the same manner as detailed in protection from evil. This spell's descriptor varies depending on the outsider race selected, gaining the alignment descriptors opposite to the alignment of the outsider race-for example, lawful and good if the race is chaotic and evil, chaotic if the selected race is lawful, or none if the selected race is neutral.",Demon Hunter's Handbook,1,1,0,0,1,,,2,,,,2,,,,2,2,,,,,2,,,0,0,0,0,0,0,0,0,0,0,0,0,0,0,0,0,0,0,0,0,0,0,0,0,0,,1692,,,,,,0,,,,,,,,,,,,0,0,0,
Righteous Blood,abjuration,,good,"inquisitor 2, paladin 2",1 standard action,"V, S, DF",0,touch,,,one creature of good alignment,10 minutes/level (D),1,0,Will negates (harmless),yes (harmless),"The target creature's innate goodness infuses its body with holy energy. While this energy does not directly empower the target, it can harm embodiments of evil. Any creature that damages the target with a slashing or piercing melee weapon is sprayed by the target's holy blood. If the attacker is a creature with the evil subtype, it takes 1d6 points of damage from divine power each time it successfully hits the target. If the target has the good subtype or an ability that grants it an aura of good (like paladins or some clerics), its blood instead deals 2d6 points of damage. Creatures that don't have the evil subtype or that are using reach weapons are not subject to this damage.",Demon Hunter's Handbook,1,1,0,0,1,,,,,,,2,,,,2,,,,,,2,,,0,0,0,0,0,0,0,0,0,0,0,0,0,0,0,1,0,0,0,0,0,0,0,0,0,,1693,,,,,,0,,,,,,,,,,,,0,0,0,
