name,school,subschool,descriptor,spell_level,casting_time,components,costly_components,range,area,effect,targets,duration,dismissible,shapeable,saving_throw,spell_resistence,description,source,verbal,somatic,material,focus,divine_focus,sor,wiz,cleric,druid,ranger,bard,paladin,alchemist,summoner,witch,inquisitor,oracle,antipaladin,magus,adept,deity,SLA_Level,domain,short_description,acid,air,chaotic,cold,curse,darkness,death,disease,earth,electricity,emotion,evil,fear,fire,force,good,language_dependent,lawful,light,mind_affecting,pain,poison,shadow,sonic,water,linktext,id,material_costs,bloodline,patron,mythic_text,augmented,mythic,bloodrager,shaman,psychic,medium,mesmerist,occultist,spiritualist,skald,investigator,hunter,haunt_statistics,ruse,draconic,meditative,summoner_unchained
Bless,enchantment,compulsion,mind-affecting,"cleric/oracle 1, paladin 1, inquisitor 1, shaman 1",1 standard action,"V, S, DF",0,50 ft.,"The caster and all allies within a 50-ft. burst, centered on the caster",,,1 min./level,0,0,none,yes (harmless),Bless fills your allies with courage. Each ally gains a +1 morale bonus on attack rolls and on saving throws against fear effects. Bless counters and dispels bane.,PFRPG Core,1,1,0,0,1,,,1,,,,1,,,,1,1,,,1,,1,"Community (1), Leadership (1), Resolve (1)",Allies gain +1 on attack rolls and saves against fear.,0,0,0,0,0,0,0,0,0,0,0,0,0,0,0,0,0,0,0,1,0,0,0,0,0,Bless,46,,Celestial (3),Ancestors (2),"The +1 morale bonus applies on attack rolls, weapon damage rolls, and all saving throws. Once during the spell's duration, an affected creature can roll an attack roll or saving throw twice and take the higher result. The target must decide to use this ability before the first roll is attempted.",,1,,1,,,,,,,,,,0,0,0,
Bless Water,transmutation,,good,"cleric/oracle 1, paladin 1, inquisitor 1",1 minute,"V, S, M (5 pounds of powdered silver worth 25 gp)",1,touch,,,flask of water touched,instantaneous,0,0,Will negates (object),yes (object),"This transmutation imbues a flask (1 pint) of water with positive energy, turning it into holy water.",PFRPG Core,1,1,1,0,0,,,1,,,,1,,,,1,1,,,,,1,Divine (2),Makes holy water.,0,0,0,0,0,0,0,0,0,0,0,0,0,0,0,1,0,0,0,0,0,0,0,0,0,Bless Water,47,25,,Water (2),,,0,,,,,,,,,,,,0,0,0,
Bless Weapon,transmutation,,,paladin 1,1 standard action,"V, S",0,touch,,,weapon touched,1 min./level,0,0,none,no,"This transmutation makes a weapon strike true against evil foes. The weapon is treated as having a +1 enhancement bonus for the purpose of bypassing the DR of evil creatures or striking evil incorporeal creatures (though the spell doesn't grant an actual enhancement bonus). The weapon also becomes good-aligned, which means it can bypass the DR of certain creatures. (This effect overrides and suppresses any other alignment the weapon might have.) Individual arrows or bolts can be transmuted, but affected projectile weapons (such as bows) don't confer the benefit to the projectiles they shoot. In addition, all critical hit rolls against evil foes are automatically successful, so every threat is a critical hit. This last effect does not apply to any weapon that already has a magical effect related to critical hits, such as a keen weapon or a vorpal sword.",PFRPG Core,1,1,0,0,0,,,,,,,1,,,,,,,,,,1,Glory (2), Weapon strikes true against evil foes.,0,0,0,0,0,0,0,0,0,0,0,0,0,0,0,0,0,0,0,0,0,0,0,0,0,Bless Weapon,48,,,,,,0,,,,,,,,,,,,0,0,0,
Break Enchantment,abjuration,,,"bard 4, cleric/oracle 5, paladin 4, sorcerer/wizard 5, witch 5, inquisitor 5, shaman 5, occultist 4, psychic 4, mesmerist 4, spiritualist 5, medium 4",1 minute,"V, S",0,close (25 ft. + 5 ft./2 levels),,,"up to one creature per level, all within 30 ft. of each other",instantaneous,0,0,see text,no,"This spell frees victims from enchantments, transmutations, and curses. Break enchantment can reverse even an instantaneous effect. For each such effect, you make a caster level check (1d20 + caster level, maximum +15) against a DC of 11 + caster level of the effect. Success means that the creature is free of the spell, curse, or effect. For a cursed magic item, the DC is equal to the DC of the curse. If the spell is one that cannot be dispelled by dispel magic or stone to flesh, break enchantment works only if that spell is 5th level or lower. If the effect comes from a permanent magic item, break enchantment does not remove the curse from the item, but it does free the victim from the item's effects.",PFRPG Core,1,1,0,0,0,5,5,5,,,4,4,,,5,5,5,,,5,,5,"Liberation (5), Luck (5), Restoration (5)","Frees subjects from enchantments, transmutations, and curses.",0,0,0,0,0,0,0,0,0,0,0,0,0,0,0,0,0,0,0,0,0,0,0,0,0,Break Enchantment,53,,Destined (11),,"Against non-mythic effects, the spell automatically succeeds without requiring a caster level check. Against mythic effects, add your tier to your caster level check. The maximum level of spell this spell can remove is 5 + half your tier.","Augmented (7th): If you expend two uses of mythic power, you can apply a removed enchantment, transmutation, or curse to the creature that originally cast it. The creature must be a valid target of the spell and on the same plane as you, and it gets a saving throw at the effect's original DC.",1,,5,4,4,4,4,5,,,,,0,0,0,
Bull's Strength,transmutation,,,"cleric/oracle 2, druid 2, paladin 2, sorcerer/wizard 2, summoner/unchained summoner 2, alchemist 2, antipaladin 2, magus 2, bloodrager 2, shaman 2, psychic 2, medium 2",1 standard action,"V, S, M/DF (a few hairs, or a pinch of dung, from a bull)",0,touch,,,creature touched,1 min./level,0,0,Will negates (harmless),yes (harmless),"The subject becomes stronger. The spell grants a +4 enhancement bonus to Strength, adding the usual benefits to melee attack rolls, melee damage rolls, and other uses of the Strength modifier.",PFRPG Core,1,1,1,0,1,2,2,2,2,,,2,2,2,,,2,2,2,2,,2,"Rage (2), Strength (2)",Subject gains +4 to Str for 1 min./level.,0,0,0,0,0,0,0,0,0,0,0,0,0,0,0,0,0,0,0,0,0,0,0,0,0,Bull's Strength,55,,"Abyssal (5), Orc (5)",Strength (4),,,0,2,2,2,2,,,,,,2,,0,0,0,2
Create Water,conjuration,creation,water,"cleric/oracle 0, druid 0, paladin 1, inquisitor 0, shaman 0, occultist 0",1 standard action,"V, S",0,close (25 ft. + 5 ft./2 levels),,up to 2 gallons of water/level,,instantaneous,0,0,none,no,"This spell generates wholesome, drinkable water, just like clean rain water. Water can be created in an area as small as will actually contain the liquid, or in an area three times as large--possibly creating a downpour or filling many small receptacles. This water disappears after 1 day if not consumed. Note: Conjuration spells can't create substances or objects within a creature. Water weighs about 8 pounds per gallon. One cubic foot of water contains roughly 8 gallons and weighs about 60 pounds.",PFRPG Core,1,1,0,0,0,,,0,0,,,1,,,,0,0,,,0,,0,,Creates 2 gallons/level of pure water.,0,0,0,0,0,0,0,0,0,0,0,0,0,0,0,0,0,0,0,0,0,0,0,0,1,Create Water,104,,,,,,0,,0,,,,0,,,,0,,0,0,0,
Cure Light Wounds,conjuration,healing,,"bard 1, cleric/oracle 1, druid 1, paladin 1, ranger 2, witch 1, inquisitor 1, alchemist 1, shaman 1, occultist 1, spiritualist 1",1 standard action,"V, S",0,touch,,,creature touched,instantaneous,0,0,Will half (harmless); see text,yes (harmless); see text,"When laying your hand upon a living creature, you channel positive energy that cures 1d8 points of damage + 1 point per caster level (maximum +5). Since undead are powered by negative energy, this spell deals damage to them instead of curing their wounds. An undead creature can apply spell resistance, and can attempt a Will save to take half damage.",PFRPG Core,1,1,0,0,0,,,1,1,2,1,1,1,,1,1,1,,,1,,1,Healing (1),Cures 1d8 damage + 1/level (max +5).,0,0,0,0,0,0,0,0,0,0,0,0,0,0,0,0,0,0,0,0,0,0,0,0,0,Cure Light Wounds,108,,,,The damage cured increases to 2d8 points of damage + 2 points per caster level (maximum +10). The spell cures up to 1 point of ability damage if the target is a living creature. The target chooses what type of ability damage is cured.,,1,,1,,,,1,1,,,1,,0,0,0,
Cure Moderate Wounds,conjuration,healing,,"bard 2, cleric/oracle 2, druid 3, paladin 3, ranger 3, witch 2, inquisitor 2, alchemist 2, shaman 2, occultist 2, spiritualist 2",1 standard action,"V, S",0,touch,,,creature touched,instantaneous,0,0,Will half (harmless); see text,yes (harmless); see text,"This spell functions like cure light wounds, except that it cures 2d8 points of damage + 1 point per caster level (maximum +10).",PFRPG Core,1,1,0,0,0,,,2,3,3,2,3,2,,2,2,2,,,2,,2,Healing (2),Cures 2d8 damage + 1/level (max +10).,0,0,0,0,0,0,0,0,0,0,0,0,0,0,0,0,0,0,0,0,0,0,0,0,0,Cure Moderate Wounds,112,,,,The damage cured increases to 4d8 points of damage + 2 points per caster level (maximum +20). The spell cures up to 2 points of ability damage if the target is a living creature. The target chooses what types of ability damage are cured.,,1,,2,,,,2,2,,,3,,0,0,0,
Cure Serious Wounds,conjuration,healing,,"bard 3, cleric/oracle 3, druid 4, paladin 4, ranger 4, witch 4, inquisitor 3, alchemist 3, shaman 3, occultist 3, spiritualist 3",1 standard action,"V, S",0,touch,,,creature touched,instantaneous,0,0,Will half (harmless); see text,yes (harmless); see text,"This spell functions like cure light wounds, except that it cures 3d8 points of damage + 1 point per caster level (maximum +15).",PFRPG Core,1,1,0,0,0,,,3,4,4,3,4,3,,4,3,3,,,3,,3,Healing (3),Cures 3d8 damage + 1/level (max +15).,0,0,0,0,0,0,0,0,0,0,0,0,0,0,0,0,0,0,0,0,0,0,0,0,0,Cure Serious Wounds,114,,,,The damage cured increases to 6d8 points of damage + 2 points per caster level (maximum +30). The spell cures up to 3 points of ability damage if the target is a living creature. The target chooses what types of ability damage are cured.,,1,,3,,,,3,3,,,4,,0,0,0,
Daylight,evocation,,light,"bard 3, cleric/oracle 3, druid 3, paladin 3, sorcerer/wizard 3, inquisitor 3, magus 3, shaman 3, occultist 3",1 standard action,"V, S",0,touch,,,object touched,10 min./level (D),1,0,none,no,"You touch an object when you cast this spell, causing the object to shed bright light in a 60-foot radius. This illumination increases the light level for an additional 60 feet by one step (darkness becomes dim light, dim light becomes normal light, and normal light becomes bright light). Creatures that take penalties in bright light take them while within the 60-foot radius of this magical light. Despite its name, this spell is not the equivalent of daylight for the purposes of creatures that are damaged or destroyed by such light. If daylight is cast on a small object that is then placed inside or under a light-proof covering, the spell's effects are blocked until the covering is removed. Daylight brought into an area of magical darkness (or vice versa) is temporarily negated, so that the otherwise prevailing light conditions exist in the overlapping areas of effect. Daylight counters or dispels any darkness spell of equal or lower level, such as darkness.",PFRPG Core,1,1,0,0,0,3,3,3,3,,3,3,,,,3,3,,3,3,,3,"Day (3), Light (3)",60-ft. radius of bright light.,0,0,0,0,0,0,0,0,0,0,0,0,0,0,0,0,0,0,1,0,0,0,0,0,0,Daylight,120,,,"Light (6), Summer (6)",The illumination in the additional 60 foot radius increases to at least normal light regardless of the existing lighting conditions. Creatures that take penalties in bright light double those penalties while in the area of bright light produced by this spell. All other creatures in the area of bright light gain a +2 circumstance bonus on Perception checks and saves to resist fear.,,1,,3,,,,3,,,,3,,0,0,0,
Death Ward,necromancy,,,"cleric/oracle 4, druid 5, paladin 4, witch 4, inquisitor 4, alchemist 4, occultist 4, spiritualist 4, medium 4",1 standard action,"V, S, DF",0,touch,,,living creature touched,1 min./level,0,0,Will negates (harmless),yes (harmless),"The subject gains a +4 morale bonus on saves against all death spells and magical death effects. The subject is granted a save to negate such effects even if one is not normally allowed. The subject is immune to energy drain and any negative energy effects, including channeled negative energy. This spell does not remove negative levels that the subject has already gained, but it does remove the penalties from negative levels for the duration of its effect. Death ward does not protect against other sorts of attacks, even if those attacks might be lethal.",PFRPG Core,1,1,0,0,1,,,4,5,,,4,4,,4,4,4,,,,,4,"Death (4), Repose (4)",Grants bonuses against death spells and negative energy.,0,0,0,0,0,0,0,0,0,0,0,0,0,0,0,0,0,0,0,0,0,0,0,0,0,Death Ward,124,,,,,,0,,,,4,,4,4,,,5,,0,0,0,
Delay Poison,conjuration,healing,,"bard 2, cleric/oracle 2, druid 2, paladin 2, ranger 1, alchemist 2, witch 2, inquisitor 2, shaman 2, occultist 2, mesmerist 2",1 standard action,"V, S, DF",0,touch,,,creature touched,1 hour/level,0,0,Fortitude negates (harmless),yes (harmless),The subject becomes temporarily immune to poison. Any poison in its system or any poison to which it is exposed during the spell's duration does not affect the subject until the spell's duration has expired. Delay poison does not cure any damage that poison may have already done.,PFRPG Core,1,1,0,0,1,,,2,2,1,2,2,2,,2,2,2,,,2,,2,,Stops poison from harming target for 1 hour/level.,0,0,0,0,0,0,0,0,0,0,0,0,0,0,0,0,0,0,0,0,0,0,0,0,0,Delay Poison,129,,Serpentine (5),,,,0,,2,,,2,2,,,,1,,0,0,0,
Detect Poison,divination,,,"cleric/oracle 0, druid 0, paladin 1, ranger 1, sorcerer/wizard 0, shaman 0, occultist 0, psychic 0, mesmerist 0, inquisitor 0",1 standard action,"V, S",0,close (25 ft. + 5 ft./2 levels),"one creature, one object, or a 5-ft. cube",,"one creature, one object, or a 5-ft. cube",instantaneous,0,0,none,no,"You determine whether a creature, object, or area has been poisoned or is poisonous. You can determine the exact type of poison with a DC 20 Wisdom check. A character with the Craft (alchemy) skill may try a DC 20 Craft (alchemy) check if the Wisdom check fails, or may try the Craft (alchemy) check prior to the Wisdom check. The spell can penetrate barriers, but 1 foot of stone, 1 inch of common metal, a thin sheet of lead, or 3 feet of wood or dirt blocks it.",PFRPG Core,1,1,0,0,0,0,0,0,0,1,,1,,,,0,0,,,,,0,,Detects poison in a creature or object.,0,0,0,0,0,0,0,0,0,0,0,0,0,0,0,0,0,0,0,0,0,0,0,0,0,Detect Poison,139,,,,,,0,,0,0,,0,0,,,,0,,0,0,0,
Detect Undead,divination,,,"cleric/oracle 1, paladin 1, sorcerer/wizard 1, alchemist 1, inquisitor 1, shaman 1, psychic 1, mesmerist 1, spiritualist 1, medium 1",1 standard action,"V, S, M/DF (earth from a grave)",0,60 ft.,cone-shaped emanation,,,"concentration, up to 1 minute/ level",1,0,none,no,"You can detect the aura that surrounds undead creatures. The amount of information revealed depends on how long you study a particular area. 1st Round: Presence or absence of undead auras. 2nd Round: Number of undead auras in the area and the strength of the strongest undead aura present. If you are of good alignment, and the strongest undead aura's strength is overwhelming (see below), and the creature has HD of at least twice your character level, you are stunned for 1 round and the spell ends. 3rd Round: The strength and location of each undead aura. If an aura is outside your line of sight, then you discern its direction but not its exact location. Aura Strength: The strength of an undead aura is determined by the HD of the undead creature, as given on the table below. Lingering Aura: An undead aura lingers after its original source is destroyed. If detect undead is cast and directed at such a location, the spell indicates an aura strength of dim (even weaker than a faint aura). How long the aura lingers at this dim level depends on its original power, as given on the table below. HD Strength Lingering Aura Duration 1 or lower Faint 1d6 rounds 2-4 Moderate 1d6 minutes 5-10 Strong 1d6 x 10 minutes 11 or higher Overwhelming 1d6 days Each round, you can turn to detect undead in a new area. The spell can penetrate barriers, but 1 foot of stone, 1 inch of common metal, a thin sheet of lead, or 3 feet of wood or dirt blocks it.",PFRPG Core,1,1,1,0,1,1,1,1,,,,1,1,,,1,1,,,,,1,,Reveals undead within 60 ft.,0,0,0,0,0,0,0,0,0,0,0,0,0,0,0,0,0,0,0,0,0,0,0,0,0,Detect Undead,144,,,"Occult (2), Plague (2), Ethereal (2)",,,0,,1,1,1,1,,1,,,,,0,0,0,
Discern Lies,divination,,,"cleric/oracle 4, paladin 3, alchemist 4, alchemist 4, witch 4, inquisitor 4, psychic 4, medium 3",1 standard action,"V, S, DF",0,close (25 ft. + 5 ft./2 levels),,,"one creature/level, no two of which can be more than 30 ft. apart","concentration, up to 1 round/level",0,0,Will negates,no,"Each round, you concentrate on one target, who must be within range. You know if the target deliberately and knowingly speaks a lie by discerning disturbances in its aura caused by lying. The spell does not reveal the truth, uncover unintentional inaccuracies, or necessarily reveal evasions. Each round, you may concentrate on a different target.",PFRPG Core,1,1,0,0,1,,,4,,,,3,4,,4,4,4,,,,,4,Nobility (4),Reveals deliberate falsehoods.,0,0,0,0,0,0,0,0,0,0,0,0,0,0,0,0,0,0,0,0,0,0,0,0,0,Discern Lies,150,,,,,,0,,,4,3,,,,,,,,0,0,0,
Dispel Chaos,abjuration,,lawful,"cleric/oracle 5, paladin 4, inquisitor 5, shaman 5",1 standard action,"V, S, DF",0,touch,,,"you and a touched chaotic creature from another plane, or you and an enchantment or chaotic spell on a touched creature or object","1 round/level or until discharged, whichever comes first",0,0,see text,see text,"This spell functions like dispel evil, except that you are surrounded by constant, blue lawful energy, and the spell affects chaotic creatures and spells rather than evil ones.",PFRPG Core,1,1,0,0,1,,,5,,,,4,,,,5,5,,,,,5,Law (5), +4 bonus against attacks by chaotic creatures.,0,0,0,0,0,0,0,0,0,0,0,0,0,0,0,0,0,1,0,0,0,0,0,0,0,Dispel Chaos,155,,,,,,0,,5,,,,,,,,,,0,0,0,
Dispel Evil,abjuration,,good,"cleric/oracle 5, paladin 4, inquisitor 5, shaman 5",1 standard action,"V, S, DF",0,touch,,,"you and a touched evil creature from another plane, or you and an enchantment or evil spell on a touched creature or object","1 round/level or until discharged, whichever comes first",0,0,see text,see text,"Shimmering, white holy energy surrounds you. This energy has three effects. First, you gain a +4 deflection bonus to AC against attacks by evil creatures. Second, on making a successful melee touch attack against an evil creature from another plane, you can choose to drive that creature back to its home plane. The creature can negate the effects with a successful Will save (spell resistance applies). This use discharges and ends the spell. Third, with a touch you can automatically dispel any one enchantment spell cast by an evil creature or any one evil spell. Spells that can't be dispelled by dispel magic also can't be dispelled by dispel evil. Saving throws and spell resistance do not apply to this effect. This use discharges and ends the spell.",PFRPG Core,1,1,0,0,1,,,5,,,,4,,,,5,5,,,,,5,Good (5), +4 bonus against attacks by evil creatures.,0,0,0,0,0,0,0,0,0,0,0,0,0,0,0,1,0,0,0,0,0,0,0,0,0,Dispel Evil,156,,,,,,0,,5,,,,,,,,,,0,0,0,
Dispel Magic,abjuration,,,"bard 3, cleric/oracle 3, druid 4, paladin 3, sorcerer/wizard 3, summoner/unchained summoner 3, witch 3, inquisitor 3, antipaladin 3, magus 3, shaman 3, occultist 3, psychic 3, mesmerist 3, spiritualist 3, medium 3",1 standard action,"V, S",0,medium (100 ft. + 10 ft./level),"one spellcaster, creature, or object",,"one spellcaster, creature, or object",instantaneous,0,0,none,no,"You can use dispel magic to end one ongoing spell that has been cast on a creature or object, to temporarily suppress the magical abilities of a magic item, or to counter another spellcaster's spell. A dispelled spell ends as if its duration had expired. Some spells, as detailed in their descriptions, can't be defeated by dispel magic. Dispel magic can dispel (but not counter) spell-like effects just as it does spells. The of a spell with an instantaneous duration can't be dispelled, because the magical effect is already over before the dispel magic can take effect. You choose to use dispel magic in one of two ways: a targeted dispel or a counterspell. Targeted Dispel: One object, creature, or spell is the target of the dispel magic spell. You make one dispel check (1d20 + your caster level) and compare that to the spell with highest caster level (DC = 11 + the spell's caster level). If successful, that spell ends. If not, compare the same result to the spell with the next highest caster level. Repeat this process until you have dispelled one spell affecting the target, or you have failed to dispel every spell. For example, a 7th-level caster casts dispel magic, targeting a creature affected by stoneskin (caster level 12th) and fly (caster level 6th). The caster level check results in a 19. This check is not high enough to end the stoneskin (which would have required a 23 or higher), but it is high enough to end the fly (which only required a 17). Had the dispel check resulted in a 23 or higher, the stoneskin would have been dispelled, leaving the fly intact. Had the dispel check been a 16 or less, no spells would have been affected. You can also use a targeted dispel to specifically end one spell affecting the target or one spell affecting an area (such as a wall of fire). You must name the specific spell effect to be targeted in this way. If your caster level check is equal to or higher than the DC of that spell, it ends. No other spells or effects on the target are dispelled if your check is not high enough to end the targeted effect. If you target an object or creature that is the effect of an ongoing spell (such as a monster summoned by summon monster), you make a dispel check to end the spell that conjured the object or creature. If the object that you target is a magic item, you make a dispel check against the item's caster level (DC = 11 + the item's caster level). If you succeed, all the item's magical properties are suppressed for 1d4 rounds, after which the item recovers its magical properties. A suppressed item becomes nonmagical for the duration of the effect. An interdimensional opening (such as a bag of holding) is temporarily closed. A magic item's physical properties are unchanged: A suppressed magic sword is still a sword (a masterwork sword, in fact). Artifacts and deities are unaffected by mortal magic such as this. You automatically succeed on your dispel check against any spell that you cast yourself. Counterspell: When dispel magic is used in this way, the spell targets a spellcaster and is cast as a counterspell. Unlike a true counterspell, however, dispel magic may not work; you must make a dispel check to counter the other spellcaster's spell.",PFRPG Core,1,1,0,0,0,3,3,3,4,,3,3,,3,3,3,3,3,3,,,3,"Magic (3), Entropy (3)",Cancels one magical spell or effect.,0,0,0,0,0,0,0,0,0,0,0,0,0,0,0,0,0,0,0,0,0,0,0,0,0,Dispel Magic,159,,Arcane (7),,"When used as a targeted dispel, this spell can end two spells affecting the target instead of just one. If the targeted dispel successfully dispels at least one spell, you heal 1d4 points of damage for every spell level of the dispelled spell. If you dispel two spells, this healing applies only to the highest-level spell dispelled. If you use this spell to counterspell, roll your dispel check twice and take the higher result.",,1,,3,3,3,3,3,3,,,4,,0,0,0,3
Divine Favor,evocation,,,"cleric/oracle 1, paladin 1, inquisitor 1",1 standard action,"V, S, DF",0,personal,,,you,1 minute,0,0,,,"Calling upon the strength and wisdom of a deity, you gain a +1 luck bonus on attack and weapon damage rolls for every three caster levels you have (at least +1, maximum +3). The bonus doesn't apply to spell damage.",PFRPG Core,1,1,0,0,1,,,1,,,,1,,,,1,1,,,,,1,"Archon (1), Nobility (1)",You gain +1 per three levels on attack and damage rolls.,0,0,0,0,0,0,0,0,0,0,0,0,0,0,0,0,0,0,0,0,0,0,0,0,0,Divine Favor,165,,,"Devotion (2), Strength (2)","You also gain the luck bonus on saving throws and skill checks. Alternatively, you can cast this spell on another willing creature, changing the range to touch and target to living creature touched.",,1,,,,,,,,,,,,0,0,0,
Eagle's Splendor,transmutation,,,"bard 2, cleric/oracle 2, paladin 2, sorcerer/wizard 2, alchemist 2, summoner/unchained summoner 2, antipaladin 2, bloodrager 2, shaman 2, psychic 2, mesmerist 2, medium 2",1 standard action,"V, S, M/DF (feathers or droppings from an eagle)",0,touch,,,creature touched,1 min./level,0,0,Will negates (harmless),yes,"The transmuted creature becomes more poised, articulate, and personally forceful. The spell grants a +4 enhancement bonus to Charisma, adding the usual benefits to Charisma-based skill checks and other uses of the Charisma modifier. Bards, paladins, and sorcerers (and other spellcasters who rely on Charisma) affected by this spell do not gain any additional bonus spells for the increased Charisma, but the save DCs for spells they cast while under this spell's effect do increase.",PFRPG Core,1,1,1,0,1,2,2,2,,,2,2,2,2,,,2,2,,,,2,,Subject gains +4 to Cha for 1 min./level.,0,0,0,0,0,0,0,0,0,0,0,0,0,0,0,0,0,0,0,0,0,0,0,0,0,Eagle's Splendor,172,,Imperious (5),,,,0,2,2,2,2,2,,,,,,,0,0,0,2
